word,sentence
luvins,"My cats (Biscuits and Gravy) making luvins, enjoy :D"
luvly,a luvly kat
madcats,What happened here? 😂 #madcats
mahm,My mahmma manages my facebook??? page. I hope she doesn't post nudes.
mahm,My mahm is the best mahm ever.
mainecoon,"hudson_themainecoon ""Just playing with my pet rabbit."" [staring at rabbit]"
mallinois,Protection training with Boba Fett the Belgium mallinois. He's the man! ;)
maltipoo,🤭🤭Maltese you like swimming? 🤭🤭🤭 Credit by: @instagram #maltipoo #malteseofinstagram #maltes #maltesers #malteseofficial #maltipoosofinstagram #maltesepuppy #malteselovers #maltese101 #maltesedog #malteser #malshi #malteselove #ma… https://buff.ly/2ELmtyy
mamacat,Poor mamacat gets no respect
meaties,"Hooman tells me to wait for meaties, but not know that I am starving now?!"
meooo,Love meooo
meowbox,april fools cat video by meowbox
meowjesty,Her meowjesty (Credit to u/eXon91)
meowrning,"Every meowrning my cat ""helps"" me make the bed..."
meowsogyny,Escape from meowsogyny!
meowsplosion,"Marie the cat - ""meowsplosion"""
meowt,"I see you, checkin meowt"
meowt,Anyone want to take meowt running soon? I want to be cathletic.
minpin,confusing signals from minpin - go outside or stay inside?
minpin,hi I've rescued a chihuaha minpin from a hoarding situation
minpin,Zoe's results - bostonairedaleminpinchijack terrier
misbehaiving,misbehaiving so much on walks it's painful for me
misbehavin,"Try some pig pheromone to stop unruly dogs barking: If your dog is misbehaving, you might want to spray it with pig pheromones. Androstenone is found in boar saliva and helps induce sows to mate. Now it is the active ingredient in a spray marketed as being able to calm boisterous dogs"
misterioos,Maybe hooman goes out wifout me to bring back new misterioos smells.
moewing,cat videos: cute momma cat with cute newborn kittens moewing very funny
morcels,Is it inherently wrong to give morcels to my dogs while I'm eating?
morkie,6 month old shmorkie is never aggressive but has started barking
mouf,These 15 cats are well hidden … can you find them? The 12th is a camouflage pro !!
mouf,Why won't this fish come in my mouf?
mouf,Lava is trippin' out mannnnn! 🌋 #mouf
multidog,My multidog household has now reduced to one. My remaining dog is now extremely fearful and reactive.
mushball,"Rescued a dog 8 days ago. Has been a complete mushball. Within 40 minutes ago, we cannot get near her without snarling. Help or tips?"
muttier,Much muttier than expected-- Luna's results are in!
mydog,Our first day using ‘Borrowmydoggy’...
mydog,Munitions dog reporting in! [Crosspost from /lookatmydog]
mydog,Time for a dip : goldenuniversecanil (IG) #mydogiscutest https://buff.ly/2Bbejxp ~ #Dog #Dogs #Woof #Woofies #DogWoofies https://buff.ly/2BbeyIP
mydog,Wisdom results are in on my not-BC mix (x-post from r/IDmydog)
nailclipping,Have to share mindblowing nailclipping progress + question how to continue from here. 
nappin,The kidnapping of Paul Fronczak
nappin,tfw there's a new textbox and you hear that finger snapping sound effect
nappin,"Searched to see if someone saw this similiarity and was surprised noone has noticed Naul looks like a Kappa, a mythical creature known for kidnapping people."
nappin,"My 24 week old Golden Retrever puppy is a troublemaker. We love her to death but she has this issue with barking back. When we tell her ""no"" she starks barking back occasionally snapping or showing teeth."
nappin,"I bought my wife a Coton de Tulear November of last year. He's a year and a half old. My wife is 6 months pregnant and he has just recently started getting aggressive towards me, growling, snapping, and being a downright terror. I'm at a loss."
nappin,"Kidnapping, win states and Playstations in cars."
nappin,"My cat, BeeBee is NOT amused at having a selfie taken at 3 am. (I'm an insomniac, and I figure if they wake me up in the day, it's only fair, I roust them at night, when they're napping,)"
nawing,I need help with a nipping/knawing problem. 
nawing,Puppy super nawing after moving away from friends
nawing,"My MILs bichon frise. He's been gnawing at his tail for the last two years. Now that I am dog sitting for her I feel I should take him to the vet. He's a happy dog, no sign of illness. Anyone's dog ever do this? Is cutting off the tail the best option?"
neighborscat,my neighborscat
newfi,"""naughty newfie"""
newfie,"""naughty newfie"""
nibbols,"Mom only gibs me v many smol nibbols, but not a bige LICC. Is means I am a bad girle?"
nightnights,i decided that chair is bed now. im worried about hooman. will she miss me for nightnights?
nippin,Excersise rest puppy nipping and jumping
nippin,I need help with a nipping/knawing problem. 
nippin,Shiba Inu - Different techniques on how to minimize nippin
nippin,Croc takes dog that had been nipping at its tail for years
nom,Help Oafbert the Gnome get over the garden fence [x-post from /r/FlashGames]
nom,"Noticed when moving to the next dialouge box, it makes a metronome sound."
nom,Su nombre es Lupita!
nom,Catronome
nom,"Always Ready - The Defender, gaurding against the evil underpants gnomes :)"
nom,"Big Daddy from Forgotten Felines of Sonoma County in Santa Rosa, California"
nom,Nom nom kitty by ideea
nom,Snooky and the Metronome
nom,''DOCX'' Venom author Fiona Paul welke prijs Księgarnia encontrar Buch how download Noble Nook
nom,Phnom Penh's 'canine' cuisine - Cambodia
nom,"MOVSHARE ""Anomalisa"" Online. Free. Movie. PUTLOCKER."
nom,"Johny from Sonoma County Animal Services in Santa Rosa, California"
nom,Kemper &amp; Venom Suicide
nom,"Adzuki from Pets Lifeline in Sonoma, California"
nom,Mitt Romney claims GOP nomination in Utah’s U.S. Senate race
nom,Expecto Some-cat-noms!
nom,"Tierno from Forgotten Felines of Sonoma County in Santa Rosa, California"
nom,"Aye Carumba and Bright Eyes from Humane Society of Sonoma County in Santa Rosa, California"
nom,Cat Eats Corn (nom nom)
nom,"Aiko and Sumo from Forgotten Felines of Sonoma County in Santa Rosa, California"
nom,Technomancy
nom,#iwokeuplikethis #nomakeup
nom,"Minka from Forgotten Felines of Sonoma County in Santa Rosa, California"
nom,Care NLM by monomogi
nom,"Oh, just my baby bengal kitten nomming her own tail."
nommin,"Oh, just my baby bengal kitten nomming her own tail."
nomming,"Oh, just my baby bengal kitten nomming her own tail."
noms,Expecto Some-cat-noms!
noncanine,What are your noncanine pets?
nonono,My hooman put a lot of food holders in the dishwasher. I like to help so I cleaned them all up for her but she said nonono and closed the big shiny door.
nonono,Close Call... • r/nonononoyes
nosework,Doggiemon nosework snuffle mat (Yummy mat)
noyses,Prepear for the noyses
nums,Ooo! Sunday bacon num nums.
nya,"Ceaser from Tanya’s Adoption Network 4 Young Animals in Phelan, California"
nya,"Sonya and Heathcliff from Carson Cats Rescue in Manhattan Beach, California"
nya,"Wanya from Goldie and Papis’ Animal Rescue in Richmond, California"
nya,Sent in Ronyas sample to Wisdom Panel a few days ago. Now waiting for results
nya,Tanya enjoying the wheatgrass and Orianna just chilling around.
nya,"Henyareta from Deb’s Claws and Paws Rescue in Yuba City, California"
nya,"Meet my derpy cat, Nyawnyaw"
nya,Jenya
nya,Nyah-nyah not listening!
nya,thx 4 flyin wif nyan airlinez
nya,Kanal Tanıtımı : Dünyanın En İyi Kedi Videoları
nya,"DOWNLOAD BOOK ""Uncle Vanya by Anton Chekhov"" page ios prewiew offline look english iphone"
nyah,Nyah-nyah not listening!
nyoom,Why does hooman not understan dat best clean is nyoom nyoom lightspeed running clean
odders,My hooman calls me 'Buderz' somtimez an 'Good Boy' odders
offleash,"Improving ""leave it"" when strangers say ""come here"" to our offleash dog?"
okaaaay,“I’m okaaaay”
olddogs,"We get a Re-hab range for your old buddies who sometimes get tired walking or have an eyesight problem because of the the growing age. Don't let them do feel old, rather help them grow old with you! Checkout the range at www.woofsnwags.in #woofsnwagsdotin #woofsnwags #olddogs #oldies #doglove"
onsies,Any luck with post-op onsies
ouchie,Whu is Arfur an why dus his riting make my elbows ouchie?
ouchie,"Mom stepped on my paw by axi dent and did me an smol ouchie. I did many liccs and pats on her, you fink I apologizd enuff for been stepped on?"
ousside,ARFMG why my hooman yelling so loudly ousside? Loki Loki Loki! Ouch yelling hurts my ears that are very tall and open. I had to stop my fun time of chasing deer to go find my hooman to stop this noisy yelling. Now where are my chasing deer? Stay shut up hoooman I’m going to wait by the door.
outdoorz,I did a sir-prize today when my gurl hooman cooked bacon and left a plate of it on the kitchen worktop while she went outdoorz and left me inside...
ouuuut,"Let me ooouuuut! Just kidding, I got this."
ouuuut,Get ouuuut!
overatimulated,[Help] Socializing an easy overatimulated dog
overcat,hovercat on ice
owo,"Woof wooof wof wwof, wowof?"
owo,Coworker's doggo bleppin hard.
owo,"Song: Erdowie, Erdowo, Erdogan | extra 3 | NDR"
owo,A time lapse of my dog while I work from a coworking space in Memphis. Good boy.
owo,Manitowoc Police: Dog bites child in face
owtside,Wi duz hooman git mad wen poop inside. I poop owtside and hooman Kleen it up. Wi hooman Kleen if no want inside?
parkor,Zoomies combined with parkor and a dogberg
pawffice,Off to another long day at the pawffice.
pawpad,my dog was running around the backyard and she mustve cut her pawpad on glass or something because its slit right in the middle and wont stop bleeding. whats something i can do in the meantime until we go to a vet tomorrow? she doesnt look like shes in pain but its pretty bad.
pawpawrazzi,Stop the pawpawrazzi
pawsh,Mardi Gras season for pawsh
pawsome,K9 to 5: A pawsome guide to 6 types of professional dogs and what makes them such valuable working partners for humans.
pawz,"deer diarie dai 5 (part 1), mai hooman is drifting awai from mai! diving into da deep. i tri to get him back but... its to lat! as da wavz ripl in and out beneeth mai pawz, i cal out to him and sit lik good boi, except he staiez out der, striking against da curent. alon now, wat wil i do? c y diarie"
pawz,How ı will measure my dog pawz for buying dog boots.
peepads,"Trained my dog to pee on peepads in the house, will she ever stop?"
peepee,"Hooman give me treats when i peepee, so if i peepee when i see hooman, i get treats"
peetsah,"My hooman brought in some food boxes with ""peetsah"" in them."
petcord,Welcome to the less strict version of petcord.
petcosp,hello guys i am real paul petcosp and here is message
petpals,How to Do-it-yourself Ear Care for Dogs &amp; Cats - petpals
petprintr,For 17 months I have been plagued with a horrific brain injury. This is the first week of my business petprintr. This is a print business which focuses on custom clothing with an artistic rendition of your beloved pet. Please check it out thanks :)
petriarchy,Fighting the petriarchy: This is why I need felinism.
petsguide,Children and a Fear of Dogs: petsguide
petsit,Leaving the dog with a petsitter or boarding for the weekend
pettins,Are pettins a renewable resource? Dare I risk the alternative?
petz,Where could i get petz5?
photodogs,Al Roker photodogs the red carpet
pibbies,Here we go again. See the comments about poor pibbies!
pibble,Yeah what’s better than 1 pibble? 2 pibbles
pibble,Every 'pibble' adopt ad looks like this-- oh he's so goofy teehee but also homicidal
pibble,"oh look! the Pennsylvania shooter, James Saylor, was a ""pibble"" fan."
pibble,Christian Single Mothers Against Pitbulls - The Trollpage MKII (enjoy the pibblenutter salt)
pibble,“Reee breed racism!!! My pibble will kill you with kisses!!!”
pibblenutter,Christian Single Mothers Against Pitbulls - The Trollpage MKII (enjoy the pibblenutter salt)
pibbles,Yeah what’s better than 1 pibble? 2 pibbles
piktur,I sleppin an gurl tayke piktur
pillowpet,He blep on his pillowpet
pinscher,Does anyone have any clues/guesses as to this dog's breed? Owner only knew the pinscher part.
pitboxer,"I am possibly getting a pitboxer (pitbull and boxer) I have no experience in terms of owning either breed, only standard sized poodles up to this point, can I get some advice?"
pitbullpuppy,Big yawn! My sweet Tommy boy!❤️ #pitbullpuppy
pitbullx,Need help with finicky 2.5 month pitbullx puppy who hates the cold!
pitmix,I adopted my son a month ago. Sweetest boy ever. I think he’s a pitmix/staffy. And other ideas of what he might be?
pitmommy,Cross post - #pitmommy gets “educated” IRL after defending pits
pitsky,So proud of our 4.5 months old pitsky! Everyone meet Canelo. We got him about 2 weeks ago and so proud of his improvement. He is a very smart dog.
pitsky,"[Update] Introducing Kovu, the pitsky?"
pitsky,My pitsky Belle being super creepy!
pittbull,#pittbullawarenessmonth
pittbull,These people turned their home into a pittbull fortress with a security fence. Every time anyone walks on foot or bike by they are greeted by vicious dogs barking. Me thinks they might be connected to a local Mexican street gang here in SoCal
pittbullawarenessmonth,#pittbullawarenessmonth
pittie,Ooh my pittie would never hurt a fly! I don’t get you dog haters!11!1!1!1!
pittie,Why do we need a pitbull awareness month when nutters spend every day reminding you they exist? 🙄 #tittiesandpittiesmatter
pittie,"omg guyz, how can u hate pitties? just look at how cute mine is!!!"
pittie,Reminiscing on being attacked by pitties.
pitties,Why do we need a pitbull awareness month when nutters spend every day reminding you they exist? 🙄 #tittiesandpittiesmatter
pitties,"omg guyz, how can u hate pitties? just look at how cute mine is!!!"
pitties,Reminiscing on being attacked by pitties.
pizzacat,Pizzacat Purp Tee -- official @the_pizzacat MOST EPIC tshirt
plasticat,plasticat
playbiting,Puppy won't stop stop playbiting 🤦🏼‍♀️
playdate,Should I cancel my puppy’s playdates?
playdate,chicago puppy playdate!
playdates,Should I cancel my puppy’s playdates?
playfight,my hoomo wanted to playfight me but his index fingers are bigger than my snout
playfight,"Little Kitten vs Little Puppy :) they both enjoyed themselves, just coz one of them was better at playfighting...﻿"
playsez,"Of all playsez he could have put them, why did Hooman have to put the schmackos jar all the way up on the counter? In case you four got Hooman, I'm not as tall as u!!"
playtimes,Dog knows when playtimes over and refuses to listen.
playz,Want too playz
ploop,I can even hear the *ploop* sound
pls,No pictures pls
pls,Anyone plsssssss
pls,am sorry pls forgiv
pls,"How to anti bark? Save 50% each on no bark collar,pls Enter code A53Y79A4 at checkout."
pls,how 2 intsall Dogkon pls
plushie,My cat Peach plays with her Totoro plushie
pomchi,Results are in for my pomchi-cockerpug-doxiepoo [x-post r/dogs]
pompomeranians,Pomeranians should be called pompomeranians
poofing,Tortie kitten poofing while playing
poophoria,"Meet Peanut, our 8 year old deaf cat who regularly gets poophoria"
poopie,"I eat because I poopie, and I poopie because I eat."
poopie,What does hooman do with all of my poopies? He picks them up on our w.a.l.ks and collects them in the big treat container outside. I must investigate!
poopies,What does hooman do with all of my poopies? He picks them up on our w.a.l.ks and collects them in the big treat container outside. I must investigate!
poopin,"Why do humans poop in one spot instead of pooping, taking a few steps, pooping, taking a few steps, pooping, GODDAMNIT VICKY JUST STAY STILL."
poopin,"When pooping in a public place do I need to do ""Chewbacca noises"" AND the ""guilty rapist"" expression, or is one enough?"
poopin,My dog is peeing/pooping all over my aprtment
poopin,My hooman maintains eye kontakt with me whil I’m pooping but when I try to watch her poop she akts like I’m being weerd.... hu’s the weerd won?
poopin,“You poopin?”
poopin,"Anyone who used this book to train your dog? My labrador is 1 year old and has very bad attidude. Barking in the night, pooping everywhere etc. and I want to start training process but without hitting him. Will this book help me in the process?"
poopoos,"Everytime I go poopoos, my hooman picks up it and takes it away. Where do they take my poopoos???"
poopy,Hooman like nice Kleen Catto beyter dan dirty poopy doggo. Doggo poop to mush!
poopy,Spoopy
poopy,Spoopy Pupper👻🐾
poopy,Does this poopy location count?
pooted,i pooted
poots,"Mai hooman calls me doryan, wyrdo, and stinkbut (but only when i make air poots). Which iz mai name?"
potatoing,The grace and elegance of a natural born hunter. (Slight potatoing of image quality)
pottie,Happy Spotties (Cheetahs purring)
pottying,"Dog is pottying in the house, and driving a wedge in my relationship, I'm out of ideas."
pottys,My toilet trained dog pottys in the house as an attention seeking behavior. When I catch her in the act is it appropriate to shut her outside?
pottytrain,What to do w/ friends seemingly unpottytrainable dog
pottytrain,My pottytrained dogs have starting having accidents in the house. Help!
pottytrain,Just bought a puppy and im wondering how to pottytrain it effectively
pottytrained,My pottytrained dogs have starting having accidents in the house. Help!
ppfffshh,"My cat prefers to drink from glasses, rather than a stupid water bowl. ppfffshh."
protec,Stranger shind brite lite nd nocked on mommy window while she sleep sleep. I protec with BORKS!!!!! Mommy called coppos. Coppos say I scared him off nd am good doggo and to bark every time something is off because I am scary doggo. I am sitting at the foot of bed now and protec mommy all nite
protec,"i no many hooman wurds(lik dubleyu ay el kay, no, gubboy, sit) but hoooman know no borks(lik protecc bork, excitete bork or mailman bork)"
protec,Why can't hoomans see danger and trickery of skwerl? Must protect hoomans from skwerl
protec,"""I need a dog to protect my home and my family."" Pfft... sure thing."
protec,I sawed a. viDEo over my human’s shouldeR on the. tiny picture box. of other hooman making a ball out. The whitE cold stuff. outsides. they did A throw to. dogGo and ball heckin disappeared on ground. vv Cruel trick. someone. call DPS (doggo protective serVice)).
protec,Overly protective/fearful boreboel. Need adive
protec,FWP: Leash rule at Kootenai Falls protects public access
protec,Call to ban dogs from two Tauranga parks to protect birdlife
protec,Need advice on what to do/how to train my dog to not be overlyprotective
protec,Aquadog us here to protect Dogfort by the sea!
protec,"Every time I bork up for protecc, hooman calls me for comfortsnuggles, but iz safer for me to bork up than to comfortsnuggle"
protec,"If you have ANY questions about dogs, please considering asking my good friend, and protection dog trainer, Omri Geva, he is currently doing an AmA over /r/IAmA! [X-Post from /r/dogs]"
protec,"Spot-on Flea &amp;amp; Tick Treatment: IGR+ adulticide (3+ month protection, single use, 5ml presentation)"
protec,"Mommy cat is protective of her kittens, Pasay Manila"
protec,"Jellybeantoes: they do the attac, they do the protec, but most of all they do the sleeps's"
protec,Marijuana is federally illegal but the US government has patented it as being a neural protectant and antioxidant medicine. WTF America?
protec,A Des Moines landlord kicked out a young couple training a service dog for a combat veteran because Iowa law doesn't protect them. Check out more of my stories at DesMoinesRegister.com
protec,Moving my dog in with a protective/skidish dog.
protec,"My newfoundland confused and protective of new toy. Weird behavoir, looking for an explanation."
protec,XP: two dogs fighting to protect DD (3 months) from the other.
protec,Will I ruin my dog if I do KNPV (basically Dutch protection and obedience training) with him?
protec,"Police doggo protec hooman police, so, why hooman police exist if thems need protec?"
protec,"Welcome, Adventurers! K I N G L O N G B O Y E is seeking brave animol heroes to help protect the Doggo Kingdom!"
pucci,Bailey’s first puppuccino.
pucci,Catppuccino
pucci,Catpuccino?
puggle,8y puggle with separation anxiety keeps peeing at my SO’s place
puggle,Two 5 year old puggles awful on walks and jumps/barks too much!
puggle,We just rescued a 7 year old puggle
puggles,Two 5 year old puggles awful on walks and jumps/barks too much!
puging,Super cute pug unicorn shirt. Hilarious!! I love pugs! I'm puging magical shirt :P
pupalup,Thinking of getting a pupalup
pupies,Funny Cats 2015 Small cats pupies fighting each other
pupp,“Aww my pupper peed for me!” Bleck
pupp,What is a general timeframe for puppies to pickup and master toilet training?
pupp,"""blame the owners not the UWU puppy wuppy furry angel"""
pupp,You would never know she was hit by a car and neglected by her previous owner as a puppy. (xpost from r/pitbulls)
pupp,She was trying to give the rarepupper a home...
pupp,So r/gameofthrones has become a doggie woofer puppers sub.
pupp,There's meth on the sidewalks for cryin' out loud! Think of the puppers!
pupp,On a post about one of ten puppies dying in an accident and the OP thought her “FIL” should feel more guilty.
pupp,Dogs in pubs: Hotels offer beer and puppacinos for pets
pupp,Dankmemes dropping pupperpills
pupp,WWE puppy vs kitty wrestling compilation😀😀😀 | |TRY Not To Laugh | Pupp...
pupp,Our kitten Gorgo being a liquid puppy
pupp,9 week old Lhasa Apso puppy help!
pupp,"ShiTzu Poodle puppy keeps attacking, my wife in particular."
pupp,7mo puppy struggling with transition to bigger crate
pupp,Safe worms medicine for puppies under 5Ibs 6weeks old
pupp,Advice for ehavioural problems with Romanian rescue puppy
pupp,Partner bought 4w/o pitbull puppy without consulting me or making plans
pupp,"My retired IDD with his fresh set of doggles. Looking good, pupper."
pupp,"Arctic Division, code name: Snowpuppy, do you read dog fort?"
pupp,Our new puppy Kelev! What is she?
pupp,"Embark is on the way! Taking guesses on this ""ferocious"" puppo-beast!"
pupp,[discussion] Thoughts on AKC STAR vs Puppy Obedience Classes (x-post r/puppy101)
pupp,I (18f) need advice on how to train a puppy effectively and properly
pupp,Biosensor puppy stimulation?
pupp,"Just adopded 2 stray puppies, need some advice."
pupp,Is it possible to housebreak a puppy with unhousebroken dogs around?
pupp,How do I make my 9mos old puppy stop pulling me on walks?!
pupp,"Large breed puppy won't stop jumping up despite ""EHHH""s and being ignored, please tell me this will pass"
pupp,How to correct a puppy for biting reactively? Ignoring doesn't work if he's only biting because he wants to
pupp,[Help] Crate or Xpen for puppy while I'm at work?
pupp,Brought our new puppy home today and upstair's dog won't stop barking.
pupp,New apartment puppy. Shepherd Mix! HELPPPP
pupp,/r/FromPuppyToDog/ - Growing up before and after puppers
pupp,My SO got a puppy recently. This little deeps name is Luna. I've been calling her Tina (belcher). We've compromised on a nick name of Tuna.
pupp,"Winnie Pooh puppy, fast asleep next to his hunny jar"
pupp,Found this pupper on GeoGuessr
pupp,Dogsat my friend's pupper Sadie. I think she liked me well enough.
pupp,Brought home my first puppy! Meet Woodhouse!
pupp,Skyrim - pupper edition
pupp,FREE DOG CAPS https://thepuppykingdom.com/products/free-dog-caps
pupp,Boople puppy loaf
pupp,VERY burnt pupperloaf + temper
pupp,Investigating Rescue Pup's Breed-Mix. Would anyone like to guess Bella's mix? My initial thoughts were GSD/Rottie/ mongrel /but if you look up 'bucheron puppies' you might think differently. 'Data is Being Analysed' at Wisdom panel .Will post results once received!
pupp,Pepper the pupperino just got swabbed.
pupp,"This puppernutters results should be in soon, any guesses?"
pupp,Big yawn! My sweet Tommy boy!❤️ #pitbullpuppy
pupp,4 month old pupuppy just got bitten by a copperhead and I can't take her to the vet.
pupp,"8mo, puppy stopped getting heavier?"
pupp,"My 3month old puppy had a wee infection, finished course of antibiotics two days ago. Now has another wee infection!"
pupp,Getting ready for work (x-post r/rarepuppers)
pupp,Your puppy’s diet and its natural defences
pupp,Frenchton puppy hair loss
pupp,"Great Dane puppy seems a bit gimpy, doesn't want to stand up after naps.. Normal? x-post to r/greatdanes"
pupp,8 month old puppy has struvite crystals
pupp,When my 12 year old Daschund was a puppy they cut off his duclaws.
pupp,"Trazodone (""puppy prozac"")"
pupp,[Advice] My dog’s ears have shifted from the side of her head to the top — is this just the puppy uglies? Some have tried to tell me it is disconcerting. (Photos are 4 weeks apart)
pupp,Vaccination schedule for a puppy; breeder adamantly suggests a 12th-week single shot for DHLPP
pupp,"My 2-year-old perma puppy, pooped after a hard day of playing."
pupp,I need puppy friends! Follow me guys 🐶🐶🐶
pupp,Kourtney Kardashian reveals where she adopted her daughter Penelope's new puppy
pupp,My puppy Milkyway!
pupp,Bailey’s first puppuccino.
pupp,chicago puppy playdate!
pupp,Nanaimo small dogs and puppies
pupp,"Anyone in Atlanta, GA? Looking for puppies my 11week old akita can play with!"
pupp,What is Socialisation and what is the correct way to socialise a puppy? – An insight by Dog Training and Behaviour Expert Denise Nuttall.
pupp,State police make three arrests for cruelty in 'Sickpuppyz Pitbull Kennels'   - National Pet Rescue
pupp,Should I cancel my puppy’s playdates?
pupp,"Hey guys, my almost 5month old husky has very muddy diarrhea. He’s on Blue Wilderness puppy food. Not sure what to do. I’ve heard that food might have too much protein in it"
pupp,What Causes Dog Abuse (An Introduction) Chapter 1: Violence Against Dogs puppyd00dles.com
pupp,Set your puppies free today it's #NationalNoBraDay #diorabelle #dailydoseofdiorabelle
