word,sentence
abnerdawg,@abnerdawg being a good doggie
aborable,Why do people think it's aborable when a giant dog drools on a baby?
actiekatten,Oh no dogfort! It's actiekatten!
adobtable,Downton Tabby' the Downton Abbey Intro Made Better with CATS (who are all adobtable)!
adog,Aquadog us here to protect Dogfort by the sea!
adog,Rendog :: [S3E46] Let's Play Minecraft - Mamadog's Greenhouse!
adog,"My human is allowed to sniff that new human's crotch (they both seem to like it), but I'm a badog when I do. Not fair."
adog,Puppy for adoption (some assembly required) Rescue dog looking for a forever home in SE England... www.giveadogahome.org.uk/chloe
adog,Goodest girl [xpost from r/perksofhavingadog
adog,I was searching for dog grooming and training provider in rochester ny and i found adogsdream
adog,Scubadog
adog,Demadog
adog,"This is Canadog, Over."
adog,Anyone tried the $1 welcome dog food kit from Yadoggie?
adogsdream,I was searching for dog grooming and training provider in rochester ny and i found adogsdream
adoopted,I think I'm adoopted.
adopded,"Just adopded 2 stray puppies, need some advice."
adoptability,Unmasking the shelter dog: ​Research redefining adoptability could save many animals’ lives
adoptdontshop,#adoptdontshop Can’t wait to see what this girly turns in to! Any breed ideas?
adoptiversary,Some of y'all might remember Hamilton - today is his adoptiversary! (63.7% Catahoula 9.2% Treeing Walker Coonhound 4.6% Lab 22.5% Supermutt)
adowable,My adowable cat prefers bags to boxes
adventuredogs,"Clash of the Titans, kinda. Dog hike shenanigans. #adventuredogs"
alla,Account reser after reinstallation
alla,[Fox-Tv]Dallas Cowboys vs San Francisco 49ers Live Straming Online Tv 2018
alla,Halla everybadaaaaaaa!
alla,'Getting over' dog days... (thanks Redditor cballar5 *wink)
alla,"Police investigate after two dogs attack child, babysitter tobogganing in Wallaceburg - Windsor"
alla,Diablo Von Valhalla - My 9 month Schutzhund puppy (x-post /r/GermanShepherdDog)
alla,"Gallaudet from Sante d’Or Foundation in Los Angeles, California"
alla,DOG NURSING CAT -Cane allatta gatto piccolo piccolo! (+playlist)
alla,Fear for roaming dogs as wallaby mauled at Springdale Heights
almatian,DNA MY DOG RESULTS FOR RUSTY Level 3 Alaskan Malamute Dalmatian Level4 German Short Haired Pointer Rottweiler Level 5 Weimaraner
almatian,Dalmatian 2month puppy wont stop crying. Help.
almatian,Vitamin D(almatian)
aminals,"I noticed round noonish, when hooman takes her lunch, is perfect time for nap time. All aminals, including cats, take nap around then. Is best time for nap."
anatolianshepherds,My babies 😍 Anatolian Shepherds #anatolianshepherds
angery,"Grr arg. I am the evil Darklord LONGSNOOT, and I am a naughty boy! I need naughty animols to help me capture Queen LONGGIRLE! am angery"
angery,Grr arg - I am the evil Darklord L O N G S N O O T and I am looking for minions to help me capture Queen L O N G G I R L E! (am angery)
angriety,separation angriety
animalcare,"Interested in animal apparel, help animalcare and cop yourself a nice animal inspired item at the same time"
animol,"Welcome, Adventurers! K I N G L O N G B O Y E is seeking brave animol heroes to help protect the Doggo Kingdom!"
animol,"Grr arg. I am the evil Darklord LONGSNOOT, and I am a naughty boy! I need naughty animols to help me capture Queen LONGGIRLE! am angery"
animols,"Grr arg. I am the evil Darklord LONGSNOOT, and I am a naughty boy! I need naughty animols to help me capture Queen LONGGIRLE! am angery"
anypuppy,Does anypuppy else fink that hoomins collect our poops because they donut do poops themslevs?
apso,Trying to crate-train two senior lhaso apsos
apso,Rhapsody developing Wubba drive for Dock Diving
arf,Naval Jack/warflag of Doggerland | Marietiem flag/krigflag fvan Doggerlundt
arf,Omniglot Useful Phrases for Doggish | Omniglot Brukbarfrasen Doggsk
arf,"6 y/o doggo looking for a mate to flounce tails together. Likes: long hops on the couch, growl-snarfing at my brother when he tries to steal my treats, freakily narcissistic t-shirts. Must luv borking at the door when mom arrives home."
arf,Help with 9 month old frenchie harrasing a 3 year old dwarf-pincher?
arf,A bajillion books that owners of fearful dogs should consider
arf,Training a shy fearfull dog in one week
arf,I did it! I found the worst one yet - 'woofer'. *Barf*. They really like to romanticize the annoying behaviours of dogs.
arf,My weiner is all wrapped up in a scarf
arf,"Chihuahua(7yrs) is suddenly acting like an abused animal, fearful and screeching in ""pain"""
arf,"Poodle, Carine Terrier Mix; Abused and Adopted: Fearful of New People, Bites Sometimes | Input"
arf,Overly protective/fearful boreboel. Need adive
arf,Dwarf Dachs attacks me and avoids me
arf,I need help with my frearful/aggressive pitbull.
arf,Helping the Shy or Fearful Dog - article from the San Fransisco SPCA. (pdf)
arf,Arf arf arf arf arf arf arf arf arf!
arf,My multidog household has now reduced to one. My remaining dog is now extremely fearful and reactive.
arf,9 month old Beauceron fearful behavior
arf,"Help with an extremely fearful, 2ish year-old, 15lb dachshund"
arf,Whit garfelt.
arf,Halp! I tries to share bone wiff hooman. But he throws it across da room. I bring it back N he throws it again. Afraid my hoomans gonna starff to deaff :(
arf,"April cell vid reel ft. Garfield, Coachella, etc: APE REEL 2012: ""YOYO"" - YouTube"
arf,"Starfire from Friends Forever in Auburn, California"
arf,"NS The names Dog, Snarf Dog."
arf,Starfucked flame catsuit gfy
arf,Starfucked in a sailor catsuit
arf,"Angel and Sugarfoot from Lori’s Angels Animal Rescue in Granada Hills, California"
arf,"Siberian cats Snow white Hoarfrost Koshlyandiya December 19, 2014"
arrebarkour,"BORK! My hooman showed me a place, where it's all doggos running and jumping and swimming around. He said it's called arrebarkour. Its great! Every doggo should visit!"
arw,Dog beach review from Collendina through to Barwon Heads
arw,"This is Darwin, any guesses!? Just sent out his dna test. He’s 6 years old and about 65lbs."
arw,"Hello DOG LOVERS! As redditor fellow who just saterted a online shop,I thought it would be great to make a giveaway, so we arw giving a few DOG LED COLLARS, all you have to do is leaving a honest review and pay a small shipping fee!"
arw,Marwins room ?
arw,Darwin is so pleased with himself. Look at that smile! 😇
atenchin,Hooman is not payying atenchin to mez
attac,Resocializing GSD after she was repeatedly attacked
attac,"My dog got attacked this morning in front of my house. My dog usually walks off leash, and she ran down the stairs unencumbered as always. The other dog looked pissy so I grabbed my pup and held her from greeting the dog. The other dog’s companion told me that he was friendly so I let her go."
attac,"Mirrors problem, keeps attacking its refleciton"
attac,u/piglover352 i mean shit like this (sorry for not replying but i cant attach a picture to a comment) only 7 hours ago
attac,"My human is afraid of walking alone so he always attaches me to him with a rope, is this normal?"
attac,Is it harmful to attach a leash to your dog’s neck? - by Emily Larlham (aka kikopup)
attac,How to avoid having an ill behaved dog ! http://petdingo.org/dog-socialization-how-to-avoid-having-an-ill-behaved-dog-that-attacks-people-and-other-pets/
attac,Everything you need to know about dog bites—and what to do if you’ve been attacked
attac,"PT.2 im suspecting either a panic/anxiety attack of sorts,or maybe a seizure? she curls up/gets all bent and twisted in her back area,and gets shakey and stumbles around.her eyes widen and she has a blank expression"
attac,"[Image kinda gory, maybe NSFW] My 80-lb AmStaff was on leash. Other dog was off leash, charged and attacked. Now I have a $700 vet bill for my dog's injuries. Advice needed."
attac,"Dogtor Luna’s Identity? Took her from a dumpster at work (along with her extremely diverse siblings.) She was attached to me (and the only one that actually came to me when found), had to keep her. I saw this nearly identical dog on SC. Always wanted to know what breed my little girl is, any ideas?"
attac,HELP! My 5 month old puppy attacks me aggresively when I take her on walks
attac,get attachment 7.aspx
attac,Dog attack leaves more than 100 birds dead at Furr HS agriculture pen
attac,Current perspectives on attachment and bonding in the dog–human dyad
attac,Dog barks and attacks everything from a vacuum to fishing pole to cordless screwgun
attac,"From dog sitter: ""Your great dane is making lots of friends!"" (flatbulldog.jpg attached)"
attac,Dog attacc cat
attac,"She enjoys having a job to focus on.. My wife and I recently bought this tactical puppy harness from OneTigris for our 2 year old Pibble, I attached my canteen pouches and she walks so much better now! It eliminates distractions, she constantly focused on her duty!"
attac,Pit bull attack vs 5 cops - tase Pitbull twice with taser gun but no effect
attac,"I got smoll hurtz by other doggo at the dog park today. De doggo attacks me for no reason but I waz okay becus I defend myself. Has smoll scratch on mah face but I’m tough. Mom says we shouldn’t go back becus it could has been worse. Plz help, how can I convince mah mom park is still fun and safe?"
attac,"Possumfort to dog fort, there’s been reports of an impending attack, send backup!"
attac,Training to use Walky-Dog bike attachment
attac,"They see ""Cat Photobombing a Dog"", I see a guerrila attack. (x/post from r/pics)"
attac,Father and daughter attacked by pack of dogs on North Taranaki beach
attac,https://m.sunshinecoastdaily.com.au/news/mums-warning-after-dog-attack-leaves-girl-5-with-f/3228193/
attac,Dwarf Dachs attacks me and avoids me
attac,Overly attached inscure dog. Help please
attac,"Arrooo WOOF, I'm under attack!"
attac,Emerald Mountain's Blackmere trail closed after dog attacks elk calf
attac,Gilmanton postal carrier airlifted after dog bursts through screen to attack | New Hampshire
attac,Reminiscing on being attacked by pitties.
attac,Man attacked by pitbulls in Millrise
attac,"ShiTzu Poodle puppy keeps attacking, my wife in particular."
attac,"One of the pit bulls that killed Gulfport woman had attacked before, cops say (X-post /r/news)"
attac,Magistrate labels owner 'in denial' over dog's friendliness while handing down thousands of dollars in fines for Wangara attacks
attac,Dog attacks kill more than 25 lambs at Baldrine farm
attac,[NH] Crazy neighbor's dog attacked and I had to kill him. Less worried about legal repercussions and more worried about neighbor killing ME. How illegal is it if I never tell him and he finds out? • r/legaladvice
attac,8-month-old girl killed in Miramar dog attack
attac,Police dog dies after axe-wielding man shouting ‘Allahu Akbar’ attacked armed officers
attac,"Stray dog attack: No kid should become a victim of such an attack, say Praveen's parents"
attac,Cullman Co. child airlifted to hospital after dog attack doing ‘amazing’
attac,"Tinonee koalas being attacked, mauled and killed by dogs"
attac,Lawsuit filed after dog’s attack on toddler at Hollenback
attac,Skamania County woman survives attack by five dogs
attac,"Pit bull breeders create petition and asked “ADL, NAACP, Legislators, and SPLC” to add four organizations to hate groups list, and want FBI to investigate. The four orgs are victims groups or track dog attack fatalities."
attac,"Brother, sister treated for rabies after dog attack in Allegan County"
attac,SoDo woman attacked by dogs from woman's RV
attac,Two pit bulls euthanized after attacking boy on George Street in Hagerstown
attac,Vicious dog attack...on own reflection! HEELL YEHA !!
attac,"My dog (f1.5), attacks strangers and family out of nowhere"
attac,"Help, my 16mo. border mix is having panic attacks and I don't know what to do"
attac,How do I prevent attachement issues/ seperation anxiety in a 6 week old puppy?
attac,"Dog that attacked Fairborn woman is aggressive, neighbors say"
attac,Two-month-old Jemma-Linda continues to recover after pit bull attack
attac,"Florida boy, 4, attacked by dog in Winn-Dixie parking lot"
attac,"SFPD looking for two Pit Bulls, owner who took off after attack at Dolores Park"
attac,Hunting cats on Vine: #catattack
attac,My cat Irisa was acting crazy while trying to attack my other cat Peanut
attac,Cat attacking autosweeper
attac,[TH7] Giant-Healer [175 Camp Space] [3 star attack]
attac,watch Gattaca BitSnoop MediaFire 5k torrentdownloads watch 47v1
attac,Devon attacks baconnaise
attac,How do people get bots with 2mil health and 1mil attack?
attac,A cat on a Roomba attacking a dog in an argyle sweater to the music of Ludacris.
attac,"JayeK's cat Moshi, ""in a low Whiskas Orbit, attacking an asteroid belt of cat treats"""
attac,"Pit bull attacks woman, runs after police shock it with a Taser"
attac,Surprise attack from Pico.
attac,Kitten isn't sure if it is jumping or attacking
attac,Town dogs attacking sheep and small animals in Murrurundi says sheep breeder (Australia)
attac,Man bitten in face during dog attack in Repentigny
attac,"Dog attacks, injuring four people at home in Arlington HeraldNet.com"
attac,Quelle Surprise. Dog breed known for attacking people attacks it's new owners.
attac,Woman and dog attacked on walk in Katoomba
attac,"Woman attacked by a dog at work, employers claim no workman’s comp or compensation for medical cost - r/legaladvice"
attac,"Cohoes resident, concerned after two off leash dog attacks, months apart"
attac,Pensioner savaged by pack of dogs as owner watched attack (via r/BanPitBulls/)
attac,"Jellybeantoes: they do the attac, they do the protec, but most of all they do the sleeps's"
attac,Dog shot and killed after attacking police during Whipstick arrest
attac,Rottweiler euthanized after attacking boy and his mother in Brimfield
attac,"Southland man hospitalised after dogs attack head, leg"
attac,Alpaca attacked by free roaming dog; residents asked to be careful - KOBI-TV NBC5 / KOTI-TV NBC2
attac,"Young man bitten, scratched by dog in ‘nightmare’ attack in Pascoe Vale"
attac,Boris the lamb from Findon is viciously attacked by dogs
attac,"""Help, help!""-- Sunnyside man, 71, screams during dog attack caught on video."
attac,Comedian Katt Williams and his service dog (which is also an attack dog?) WTF!
attac,"After dog attack, Gastonia neighborhood asks for stricter rules"
attac,€179k for woman who feared for life in dog attack
attac,Mandurah dog attack victim calls for beach zoning change
attac,"'Ban dogs from pubs, or muzzle them in pubs' - Reaction after five-year-old girl attacked by a dog in Penwortham pub"
attac,Third dog attack in Montevallo subdivision 'terrifying'
attac,Moultrie woman recovering after attack by three dogs
attac,"Dog attacks police officers, gets tazed. Whimpers start at 2:20"
attac,City of Joondalup penalty for dog attack not enough says victim | Community News Group
attac,Child mauled in dog attack in Nuneaton
attac,Owner charged in Ambridge dog attack
attac,"NYPD: Pit bull in subway attack was a ""service dog"", owner still facing charges"
attac,"Whaplode dog owner fined £2,000 after teenager attacked"
attac,2 unleashed dogs attack patron inside an Asheville bar
attac,Hartwell grandmother gets 10 years probation in deadly dog attack on grandson
attac,"Dog in China attacks over 20 people; Youtubers rejoice, laugh, call victims ""Chinks"""
attac,Owner of Rottweilers cited for 'dangerous dogs' after attack in Pupukea
attac,"Average of one dog attack every day in Adelaideâs western suburbs in 2016/17, up from previous years"
attac,Man at center of pit bull attack speaks exclusively to CBS12
attac,Labrador didn't stand a chance after vicious dog attack in Redcar | Tyne Tees
attac,"Couple attacked, woman bit by stray dogs running in Elgin forest preserve, police say"
attac,Perth girl Cordelia Ehrhardt attacked by dog during Australia Day celebrations
attac,Eight lambs killed in attack by dogs near Bridgnorth
attac,Swans attacked by dogs let off leash at Sippy Downs
attac,https://www.washingtonpost.com/news/morning-mix/wp/2017/01/19/dogs-attacked-schoolchildren-walking-to-the-bus-leaving-one-dead-and-another-injured/?utm_term=.cb55fbe1fb25
attac,Owner of dogs involved in fatal attack on Bozeman woman: “They never showed aggression.”
attac,Pikitup employees unable to collect waste because of increasing dog attacks
attac,Man attacked by Presa Canario
attac,"Every YEAR in the US ALONE, 4.5 Million people are bitten by dogs and has increased 82% since the 1980s and is still rising leading to more than $1 BILLION a year in loses for the victims, Pit Bulls and the #1 attacker."
attac,Dog attack sends Safford man to the hospital
attac,Lawyer Paul Hergott discusses the physical and psychological harms caused by dog attacks
attac,Livestock are being attacked by dogs in Peralta
attac,Girl sustains serious eye injuries following dog attack in Topsham
attac,Man recounts 'scariest moment of my life' after Monon Trail dog attack
attac,Dog-owners warned they face £75 fine for letting pets off lead after goose attack
attac,Residents at Moncks Corner neighborhood concerned following reported dog attacks
attac,Family dog attacks boy in Castaic
attac,"Westwego woman lost eye, ear and both arms after pit bull attack"
attac,"Elderly woman injured, pet dog killed in Penrith dog attack"
attac,"Woman left with finger ""hanging off"" after dog attack in RBS branch on Deansgate"
attac,2BR - News - Two dog attacks in Haslingden
attac,"To get to know how effin crazy these 'doggo' lovers are, check this Reddit thread where a dog almost attacks a child and people are fawning over this 'doggo'. Absolute bonkers!!!"
attac,Regarding the pitbull attack of the ups driver in Puyallup Washington. One of the dog owners is a registered sexual offender named Daryll Allen Burgess. His listed address is the same as the business where the mauling occurred.
attac,Pit bull attack could result in new animal-control ordinance for Tolono
attac,Girl attacked by dog in Geraldton
attac,Hunting dogs attack three young sisters in Tokushima
attac,Charges laid over dog attack after Daylesford grandmother’s death
attac,Owner agrees to euthanize pit bull that attacked Elmont infant
attac,Three dog attacks in recent days in West Allis
attac,Dubbo grandmother traumatised by dog attack in her street | Poll
attac,4 dog attacks took place over a single day in Eastland County
attac,Stray dog attacks earn Batu Ferringhi beach one-star rating from TripAdvisor
attac,Boy (8) paralysed after dog attack - The Standard
attac,Florida dog vicously attacks and maims 4-year-old. Floridians protest in the street and pass a law saving the dog's life. Florida dog later vicously attacks and maims teenage girl. xpost /r/floridaman
attac,Herkimer Co. measure aims to keep dogs from attacking deer
attac,"'It hurt really, really bad': Dog with vicious past attacks girl in Silverton"
attac,Dog attacks have Hernando Commission considering tougher rules
attac,Dog attack Nudgee Beach: Riders account of frightening moment with horses
attac,Labor candidate Jo Chapley injured in dog attack while campaigning in seat of Adelaide
attac,Grandmother injured during alleged Grovedale dog attack
attac,Pit bulls attack on small dog prompts Waukegan to review animal control ordinance
attac,"Police investigate after two dogs attack child, babysitter tobogganing in Wallaceburg - Windsor"
attac,Dog attack warning for Highfields walkers
attac,"Girl, nine, gets surgery after dog bites her leg in savage attack in Maybole"
attac,Dog attacks teenager and 74-year-old in Welwyn Garden City park
attac,Vaccine unavailable for dog attack victims in Rahim Yar Khan
attac,DOG attacks and clashes between owners have prompted locals to lobby for a fence to separate small and large pooches at a popular Trott Park reserve.
attac,'He could've died': Toddler recovering after Gatineau pit bull attack
attac,Aylmer toddler taken to hospital after pit bull attack
attac,Merrillville man used hedge scissors to fend off pit bull with history of attacks
attac,"WTOP | Fiance’s dog attacks, critically injures woman in Calvert Co."
attac,Indianola votes to destroy pit bull that attacked 4-year-old
attac,Police hunt Brisbane dog owner after boy attacked at Thornlands
attac,Man kicks dog that previously attacked his dog (xpost from publicfreakout)
attac,Police: Woman transported to MUSC after family dog attacks her at W. Ashley home
attac,Training your dog to attack on comand
attac,Six year old boy mauled to death in dogs attack in Kakinada
attac,"IamA mod of /r/DadReflexes. I learned about this sub from this thread, where trigger dog lovers are constantly reporting every comment calling out this dog for attacking a child."
attac,Appalling dog attacks continue [Editorial Otago Daily Times NZ]
attac,"Dog attack leaves Alberta First Nation man in ICU, prompts call for dog-control plan"
attac,Kate Hawkesby: Our dog attack stats are horrific
attac,Shoalhaven third highest for NSW dog attacks
attac,"Woman killed, police attacked by dog in Canberra - ABC News (Australian Broadcasting Corporation)"
attac,My 8lb Yorkie mix rescue 'randomly' 'attacks' our 65lb Pitbull.
attac,"Dog attack in Burnsville takes the life of one pet, injures owner"
attac,Man attacked by two pitbulls walking with child in Porterville
attac,Greenville City Council adopts vicious dog ordinance after attacks
attac,Kim Zolciak reveals she kept family dog that attacked son
attac,"Authorities yet to act on dog attacks, but DFAT says no claims of immunity"
attac,Coodanup pensioner: Dog attack a ‘bloody nightmare’
attac,"Connecticut town seeks to rachet up penalties for canine attacks on dogs, humans"
attac,2BR - News - Chorley council takes dog owners to court over attacks
attac,Dogs attack 79-year-old woman in Cartersville
attac,The dog that killed a Canberran woman had attacked before
attac,Clunes dog attack fine increased after appeal
attac,TPD officer hospitalized after dog attacks him in North Toledo
attac,Woman hospitalized after dog attack in Baytown
attac,LaSalle police call for responsible dog ownership after attack
attac,Pit bull attacks woman and her 2 teen daughters in Rumford
attac,La Salle ponders ordinance after last month’s dog attack (UPDATED)
attacc,Dog attacc cat
automobowl,Swingin' around in my automobowl (x-post)
baaalll,I'm playing with my wreeecking baaalll
babyanimalgifs,#babyanimalgifs ~ #Dog #Dogs #Woof #Woofies #DogWoofies
babydog,my babydog
badgirle,"Daisy, 1 yr old female, vv goodgirle, but willing to be badgirle for a goodboye. Enjoys chewing owner’s valuable stuff and doign a happ"
badog,"My human is allowed to sniff that new human's crotch (they both seem to like it), but I'm a badog when I do. Not fair."
badog,Scubadog
baff,Hooman said I smell like a dog and I had too have a baff. Aren't I supposed to smell like doggo? My hoomans smell all kinds of different ways but I never seen them rolling in smelly stuff. What kinda plan is going on here?
baff,"I iz labbo...and so iz my doggo sister. We boff like water, like at da lake an stuff. But why do we boff hate bafftime? Hooman sez we smell nice and cleen now, and iz just water and some smelly stuff. But we don't like it at all, not even when hooman give us treets for being goodgurls. Why is dat?"
baff,"The gold/carboon toolbox glitch was intentional and clearly obvious at this point. Despite the game's baffling slow development, its business model break ethical game values."
baff,"Pools and baffs are both filled with water, but baffs are evil and pools are best thing ever!"
baffs,"Pools and baffs are both filled with water, but baffs are evil and pools are best thing ever!"
bafftime,"I iz labbo...and so iz my doggo sister. We boff like water, like at da lake an stuff. But why do we boff hate bafftime? Hooman sez we smell nice and cleen now, and iz just water and some smelly stuff. But we don't like it at all, not even when hooman give us treets for being goodgurls. Why is dat?"
bagloaf,bagloaf
ballzies,104% done with you making fun of my sits and smushed ballzies
barkbarkbarkbark,"Damn hoomins, I love master but why he shush me when I tell next door dogs shush. They not even real dogs, very not good boy or girl, they barkbarkbarkbark too much. Master tell them shuddafuckup, I say shush, master tell me you shush too."
barkbeck,PSA: this weekend there will be scary loud bangs and lights. But there will also b barkbeck Qs. Important to do lots of sniffs all around because always snacks get dropped for you.
barkfest,Day 3 of the 3am barkfest
barkijg,"My 3 year dog is becoming increasingly ansxious, barkijg at familiar objects and people"
barkin,Australian Shepherd stranger wary—mild aggression / barking
barkin,How to stop a dog from barking at home : esasy + quickly + success
barkin,Rescue DDB has issues with jumping/barking at strangers
barkin,Problem with dog (2F) barking at wife (38F) while I'm away.
barkin,"Wide array of problems with my adopted dog - new apartment, barking, biting, more barking. I'm trying to avoid getting evicted..[Long history, lonnnng read]"
barkin,"I found a video that teaches you dog to stop barking, go have a look, Teach Dog to Stop Barking - Treatpouch.com"
barkin,"Try some pig pheromone to stop unruly dogs barking: If your dog is misbehaving, you might want to spray it with pig pheromones. Androstenone is found in boar saliva and helps induce sows to mate. Now it is the active ingredient in a spray marketed as being able to calm boisterous dogs"
barkin,Minituare Dachshund 3yo male barking at birds constantly
barkin,How to control dog barking at tennants dog?
barkin,"My dogs are super ""howly"" and vocal (not actually barking) when I take them for a walk."
barkin,Neighbor upstairs complaining to landlady about my barking dogs (X-Post: AptLiving)
