word,sentence
hooma,Maybe hooman goes out wifout me to bring back new misterioos smells.
hooma,I lov hooman. very much. hooman lov me too. very much.
hooma,y hooman eat poison ‘chooclite’
hooma,I watch doggos frum my window an sum have cloos like hoomans. Is they hoomans now?
hooma,Which came first the scritches or the itches? Sometimes Doggo has itches and I scritch. But sometimes human scritches doggo foot which never had itches but now that hooman scritches it I can’t stop nibbling gnaw gnaw gnaw. It’s too itchesy. Hooman made itches out of scritches!
hooma,"Everytime I go poopoos, my hooman picks up it and takes it away. Where do they take my poopoos???"
hooma,Iz anyone else gonna eet the Crispmas kookies hooman sets out for Santa Claws?
hooma,Haha! I made my hooman get out of bed for nuthin'!
hooma,My hooman haz replaced my treetz in the jar!
hooma,I did a sir-prize today when my gurl hooman cooked bacon and left a plate of it on the kitchen worktop while she went outdoorz and left me inside...
hooma,Wut is your favrite hooman food?
hooma,"BORK! My hooman showed me a place, where it's all doggos running and jumping and swimming around. He said it's called arrebarkour. Its great! Every doggo should visit!"
hooma,Last nite my hooman sayed many new werdz!
hooma,Hnnngg this PUPPER !!! Doing him a smol blep! Look at it hoomans
hooma,The CLOUD demands it hooman.Gibb the bevermadge IMEDIATE
hooma,My is behid my ear. I like belly too. Wat iz yur sweet spot for hooman to pets you?
hooma,"I noticed round noonish, when hooman takes her lunch, is perfect time for nap time. All aminals, including cats, take nap around then. Is best time for nap."
hooma,Why does hooman have to give me a shower every time I roll in something super stinky. I was smelling goooood!!
hooma,My hoomans made a hooman puppe this weak!! I now have for hoomans at home to play with!!
hooma,"If I pout and hooman can't sees me, is I relly pouting?"
hooma,Wanting hooman to throw d ball but not wanting to give hooman d ball. Bamboozled decisionz
hooma,How duz yoo deel wid hooman frendos making new hooman frendos?
hooma,DAFUQ man - why my hooman do dis to me?
hooma,How do I tel mai hooman wat I dreem Abawt when I snooz? Waat doez hooman dreem abAwt wen she snooz? P.S. haw comfee iz AC vent to snooz on? Am I rite??
hooma,Hoomans brought home new pupper. Now hoomans trying to make me pley with them. What do I do?
hooma,Hooman take me to place wit all da squeekers and i want dem all! But hooman only giv me 1 ting. Da hoomen dat liv at da stor make him show a card and he can take anyting! I guess he teach me to leave squeeks for other frends. I be gud boi an only take one ting.
hooma,"Mai hooman calls me doryan, wyrdo, and stinkbut (but only when i make air poots). Which iz mai name?"
hooma,"FELLOW DOGGOS! Mai hooman sez, ""Barking don't work!"" and de stranjer won't goway becuz I bork, but I kep borking and de stranjer went away. Who is right? Hooman is always right?"
hooma,"Felou doggers, what du yu lubb most bout yur hooman?"
hooma,This subruffit went to Shampoo smell since hoomans found it!
hooma,Hooman left chair unattend. I kep chair warm but hooman move me.
hooma,One year ago todey my hoomans brought from a bad place they call shelter to ther home. Best year of my life. I luve my hoomans.
hooma,My hooman says my breth is like a dead fish mawkit but when she say it she rinkle nose. I confused. Dead fish mawkit sound yummy.
hooma,Dus any of my felo doggos no when hooman is gunna real thro ball or fake thro ball? I fall for that trik all time.
hooma,Wen outside is lowd an all WOOOOHOOOOOO an bangs an stuff curl up close to hooman all niggt so they nut skeered
hooma,"My hooman is so dum, I bork at the door until hooman let me outside then I Bork at door right away until they let me inside = treet evry time"
hooma,Why hoomans alwayz say NO and SHOOSH?
hooma,"I see my hooman boy smooch hooman girls, but when I blep her face dey no like it...why do hoomans blep each ofer??"
hooma,"Every time I bork up for protecc, hooman calls me for comfortsnuggles, but iz safer for me to bork up than to comfortsnuggle"
hooma,Attention puppers and doggos: Imagine your hoomans having to pay extra just to let you post your shower thoughts here. BAD ISPs! Join the fight to keep the internet free and make your hooman happy!
hooma,My hooman found a website for sorting us doggos into Hogwarts houses. I has no idea wat that is but hooman was very happy! I'm a Hufflepup!
hooma,"Hooman forgets everything. I rember where my chewy bone is buried, but hooman can't rember he buried little rectangle under the couch."
hooma,"Why is it that when im chained up in the front yard and I try telling new hooman frendz i want dem to play with me, dey run away? And when I run at dem and raise my voice even louder dey just get even more frightened?"
hooma,Don't worry hoomans... I'll save you from that evil loud suction monster! My barks will scare it away!!! Muahahah
hooma,Do hoomans think doggos think they are rude as hecj for never licking us back??
hooma,If hooman haz to keep going to the store when we run out of treats and kibblez.. Why not buy all treats kibbles and never have to go to the store again?
hooma,When will my hooman figure out I hide the remoats to the magic picture box so we can go on moar walkies?
hooma,"Why don't hooman think borking works? Hooman told me stop borking, but I kept at it and finally I borked and the intruders left."
hooma,"I iz labbo...and so iz my doggo sister. We boff like water, like at da lake an stuff. But why do we boff hate bafftime? Hooman sez we smell nice and cleen now, and iz just water and some smelly stuff. But we don't like it at all, not even when hooman give us treets for being goodgurls. Why is dat?"
hooma,Y do hooman come in smol littrs?
hooma,How many happies does your hooman make you?
hooma,"Hooman say doggo bork bork bork iz bad boy, but i bork at hooman becoz they bork bork bork all day, and they say i bad boy? No fair!"
hooma,My hooman maintains eye kontakt with me whil I’m pooping but when I try to watch her poop she akts like I’m being weerd.... hu’s the weerd won?
hooma,"deer diarie dai 5 (part 1), mai hooman is drifting awai from mai! diving into da deep. i tri to get him back but... its to lat! as da wavz ripl in and out beneeth mai pawz, i cal out to him and sit lik good boi, except he staiez out der, striking against da curent. alon now, wat wil i do? c y diarie"
hooma,"Bad dog in next door apartment called my hooman a bad name, so I yell at him and show my toofies whenever I see him. Hooman doesn't understand and tells me to 'behave.' Doesn't she know I'm defending her?"
hooma,"deer diarie dai 3, u wont beleeve wher i went todai! as i was saing yesterdai mai hooman was stuffing stuffs in da car, wel he drov mai to da forest todai! he said i good boi in car so i happy! aniewai am going camping! i have new hom her dat mai hooman cals a ‘tent’! it verrie fun here! c ya diarie"
hooma,"deer diarie dai 2, todai mai hooman was doing lots of stuffs around mai hous! he woud tak tings den stuff dem to da car! he woud no play todai so i wait for mai hooman to play with mai lik good doggo but mai hooman tuk long tim so i giv him lots of kisses and he pets mai! todai was good! c ya diarie"
hooma,"deer diarie, dai 1 wat a dai! i got too go four a earlie walk todai cuz mai hooman didnt sleep in! den, mai hooman took mai to da PARK! we ran around four wat felt lik yeers! den, i met another dawg! now am sleepie so ill finish todai later! c ya diarie"
hooma,"Totally scammed hooman today. I did my good boy potty outside. Then before I come in I getz my treat. So TODAY after I got my treat, but then I pretended I didn’t get a treat and just sat outside. Hooman said, “Dumb dog” and gavez me another treat. Oh yeah, I IZ the dumb doggo, Sure hooman. Bhahaha."
hooma,I sawed a. viDEo over my human’s shouldeR on the. tiny picture box. of other hooman making a ball out. The whitE cold stuff. outsides. they did A throw to. dogGo and ball heckin disappeared on ground. vv Cruel trick. someone. call DPS (doggo protective serVice)).
hooma,"URGENT!!!! When hoomans leave food unatended on cooking room table, it is not for us!! Pass it on befor we all get called bad boi!!"
hooma,Any oter doggos wif hoomans that is just TOO SMARTS??
hooma,"ZOMGOMGOMG, my hooman kept taking me outside and looking at the sun! There was a dark spot in the middle, but hooman was eating and drinking and laughing and pointing, and I got extra treats! Do I get extra treats when there's a dark spot on the sun?!?"
hooma,"I met a small hooman who had sumthink cald ""autizm"""
hooma,Why hoomans not speak or unnerstan langwidge of pee?
hooma,"Hooman says he will only be able to see me evry few weeks becuz him haz go to ""cawlege"". Where is cawlege, and why hooman spend so much time there rather than be at home with doggo?"
hooma,My hooman should stop asking if I'm a goodboye. Should just tell me cause I always am.
hooma,Does anyone else's hooman go to the doggo park every Mon-Fri from 9am-5pm without you?
hooma,"Ate somethin real tasty and Hooman made me spit it out then look real worry and made me puke. He worried I mad, can't be mad though! I kno my hooman would never do anything bad! I love my hooman! But sleepy time coming early tonite and hooman sleepin next to me! No complaints here!"
hooma,"I chase my big bwother awound table and it is fun and my hooman likes it, he gets happy so I chase more and sometimes I get climbed on by bwother and this is less fun and hooman says go get him so I do and then we drink water. Hooman says was that fun? Yes it fun so I look at him and say yes it"
hooma,Hooman licks hooman then other hooman happy... Me licks hooman there me bad dog!! Awooo???!!
hooma,I preten to act confused when hooman preten to throw ball. He like it...
hooma,"Reading this sub make me raelly want to get a hooman, they seem like lot of fun ! But am not sure I can take good care of it..."
hooma,Hooman said I smell like a dog and I had too have a baff. Aren't I supposed to smell like doggo? My hoomans smell all kinds of different ways but I never seen them rolling in smelly stuff. What kinda plan is going on here?
hooma,My hooman gave me squeaky ball for my birfday!! I will squeak it foreverrrr to show my thanks!
hooma,Why my hooman not want to wakies in da mornings? Are there bad girls in da work and could I make them bes the good girls?
hooma,Sometimes I wonder why hoomans are so stupid sometiOHBOYOHBOYOHBOY MY HOOMAN IS BACK!
hooma,i was born eleven months ago and hooman friend is telling people im seven years old. please help. am confused. i think i have dogzheimer' disease
hooma,"Today human didn't feeds me on time. So i ated all the food that comes out of the neigh dogs butts. Now mum says I'm ""belching horse poop"". Lady dog 1- hoomans 0."
hooma,I'm tired of my hooman play with those pokemans instead of me.
hooma,My hooman don't like Pokémons
hooma,Upbark if you think we should give our hooman names when we adopt them instead of calling them just hooman. I'm thinking of naming mine Fish.
hooma,Why does hooman not understan dat best clean is nyoom nyoom lightspeed running clean
hooma,Wut if we ar actuly the bane of sum hooman's existence?
hooma,Jesus was the greatest hooman prolly because he was trained by the world's greatest doggo.
hooma,How yoo gunna celebrate valentines with your hoomans?
hooma,My hooman dress me like sluggo and is bamboozled I am no doggo. Am I a bad boi?
hooma,When hoomanmom come home I get super zoomie excited..
hooma,Where duz hooman have to go to a groomer to get bathed and his nails clipped? And will he be by himself or will doggos be there to make sure he's OK?
hooma,Yo hooma so fat he has to keep all four arms in the air to balance!
hooma,"When hooman throw ball my old sister sometime take it and just keep it. She doesn't even chase after ball, just keeps it from me. I tell hooman and whine at sister over over over, but hooman tell me to get it and sister just huffs as she is much bigger than me. I had no ball, only sads."
hooma,"""Take one more picture hooman and the tree gets it"""
hooma,Treacherous hooman has beetrayed me - what do?
hooma,"Hello hooman! Ginagabi tayo ng uwi, ah."
hooma,"Can has birdhunt while raining, hooman?"
hooma,Diz box for me? Thank you hooman!
hooma,"don’t pap us, hooman 😡"
hooma,Agyness under clouds over hooman
hooma,"Silly hoomans, now what did they buy?"
hooma,Who do you think you are foolin hooman???
hooma,Weh-Weh and the spinning hooman wizardry
hooma,Do the hoomans know that the skybooms are dangerous?
hooma,"LPT: If hooman use brushies on you, just roll over and lie on brushy."
hooma,"Today I saw my hooman reading ""poims"" so I made my own."
hooma,"DST: hoomans marks their territories by taking gyms and make friends in pokestops, as we wee on our territories and make friends in parks"
hooma,"My hooman brought in some food boxes with ""peetsah"" in them."
hooma,My hooman is sad all the time. He's got repawsion. He doesn't play any more. How can I help? He gets really lonely even though I'm right there..
hooma,What if one day hooman came home after many forevers but I slept and missed him... and then hooman left again?!
hooma,Why does hooman always poop and pee in my waterbowl?
hooma,My hooman allowed a strange hooman into the den and the strange hooman knew my packname - should I be scared?
hooma,Why is hooman mad at barking at 2am? do he nut kno that 2am is best bork tim?
hoomam,"Hooman tricked us, we thought we were getting a walkie but now we are getting our hairs cut. These new hoomans are not our real hooomans. What if real hoomams never come back and this is new home now?"
hoomams,"Hooman tricked us, we thought we were getting a walkie but now we are getting our hairs cut. These new hoomans are not our real hooomans. What if real hoomams never come back and this is new home now?"
hooman,DAFUQ man - why my hooman do dis to me?
hooman,How yoo gunna celebrate valentines with your hoomans?
hooman,Jesus was the greatest hooman prolly because he was trained by the world's greatest doggo.
hooman,Wut if we ar actuly the bane of sum hooman's existence?
hooman,Mommo hooman is missing and no one will tell me why!
hooman,My dumb hooman was 'reading' so I tried to distrakt her with how awsum I am at wiggling.
hooman,Why does hooman not understan dat best clean is nyoom nyoom lightspeed running clean
hooman,Upbark if you think we should give our hooman names when we adopt them instead of calling them just hooman. I'm thinking of naming mine Fish.
hooman,Why does my hooman sho me away when I lick his face? :-(
hooman,My hooman don't like Pokémons
hooman,My hooman calls me 'Buderz' somtimez an 'Good Boy' odders
hooman,I'm tired of my hooman play with those pokemans instead of me.
hooman,"Today human didn't feeds me on time. So i ated all the food that comes out of the neigh dogs butts. Now mum says I'm ""belching horse poop"". Lady dog 1- hoomans 0."
hooman,This subruffit went to Shampoo smell since hoomans found it!
hooman,i was born eleven months ago and hooman friend is telling people im seven years old. please help. am confused. i think i have dogzheimer' disease
hooman,ma hooman is bestest hooman. i love ma hooman.
hooman,Sometimes I wonder why hoomans are so stupid sometiOHBOYOHBOYOHBOY MY HOOMAN IS BACK!
hooman,"Felou doggers, what du yu lubb most bout yur hooman?"
hooman,Why my hooman not want to wakies in da mornings? Are there bad girls in da work and could I make them bes the good girls?
hooman,"FELLOW DOGGOS! Mai hooman sez, ""Barking don't work!"" and de stranjer won't goway becuz I bork, but I kep borking and de stranjer went away. Who is right? Hooman is always right?"
hooman,My hooman gave me squeaky ball for my birfday!! I will squeak it foreverrrr to show my thanks!
hooman,Hooman said I smell like a dog and I had too have a baff. Aren't I supposed to smell like doggo? My hoomans smell all kinds of different ways but I never seen them rolling in smelly stuff. What kinda plan is going on here?
hooman,"Mai hooman calls me doryan, wyrdo, and stinkbut (but only when i make air poots). Which iz mai name?"
hooman,Hooman take me to place wit all da squeekers and i want dem all! But hooman only giv me 1 ting. Da hoomen dat liv at da stor make him show a card and he can take anyting! I guess he teach me to leave squeeks for other frends. I be gud boi an only take one ting.
hooman,Hoomans brought home new pupper. Now hoomans trying to make me pley with them. What do I do?
hooman,I want hooman to toss ball but instead of tossing the ball hooman trys to take the ball from me.
hooman,How duz yoo deel wid hooman frendos making new hooman frendos?
hooman,How do I tel mai hooman wat I dreem Abawt when I snooz? Waat doez hooman dreem abAwt wen she snooz? P.S. haw comfee iz AC vent to snooz on? Am I rite??
hooman,"Younger hooman just told mama hooman that i got a ""huge tooomor"""
hooman,"[META] Petition to make the use of the non-word ""hooman"" a bannable offense."
hooman,"How many of you are keeping your hooman company this Thaynksgiveen, and wat will you be doing toogether?"
hooman,"I try to spread my smell around the house with sheddy hairs, but hooman keeps feeding them to invisible trashcan squirrels. Now I have to start over."
hooman,My hooman is best not becuz she feed me and pet me but becuz today we walk to park and play ball and bitey-tuggy and I roll on ground and chew on stiks. I got treats and lots of luvs. I also dug hole. She my best fren.
hooman,"LPT: Tired from a day of chasing cats and squirrels? Lay on your back to expose your tummy to hooman. This is the universal sign for belly rubs, and you will get good rubbins and relaxations."
hooman,I iz halp hooman wif homwurk
hooman,I borked all night​ to keep my hooman safe. But hooman woke up tired and mad at me.
hooman,What do hoomans dream of when dey nap? Definitely not skwerls or katz. I wake my hooman because instinct tell me to lik face when they upset or happy or feelings. Sometimz mommy happy to wake lik dat. Sometimz no. I always thought hoomans only dream of their doggos.
hooman,"Shouldn't it be ""hyooman"" instead of ""hooman""?"
hooman,It's so considerate that hooman covers hisself in salt whenever he works out. His face is delicious!
hooman,i decided that chair is bed now. im worried about hooman. will she miss me for nightnights?
hooman,Why ar my hoomans celebratyn bige scary boom boom day?
hooman,Hooman must hold leesh during walkies or else will get lost or be stuck on sidewalk whole time. What if hooman think they walking us??
hooman,"HALp! Hooman might be brokin. Usually after W-A-L-K or playing frisbee she is salty, on her feets on her arms everywhere and she has smells. but last night in bed just her eyes made salty. lots of salty. Wat culd be causing hooman salty eyes? Wat dooo I do?"
hooman,"What is this ""dubbel-yew-ay-el-kay"" the hoomans keep on talking about?"
hooman,Halp! I tries to share bone wiff hooman. But he throws it across da room. I bring it back N he throws it again. Afraid my hoomans gonna starff to deaff :(
hooman,Hi -- first post. My [F3] hooman [M27] came home smelling like another dog. He says someone at work brought in her pet. Should I be concerned?
hooman,"I asked my hooman for tree climbing lessons. He said ""no"". I didn't know my hooman was a fully paid up member of the Squirell Protection League."
hooman,"Hello hooman! Ginagabi tayo ng uwi, ah."
hooman,Treacherous hooman has beetrayed me - what do?
hooman,"""Take one more picture hooman and the tree gets it"""
hooman,Why did you chooze ur hooman?
hooman,Wanting hooman to throw d ball but not wanting to give hooman d ball. Bamboozled decisionz
hooman,What's the stoopidest thing your hooman has ever done?
hooman,my hooman mummy makes me do this she says 'nose' and then i hafta sit still until i can have treats.
hooman,"My hooman wrapped his paws around me collar and said ""I love you"" over and ovr"
hooman,I'm pretty sure the hoomans put something called unyuns and chocklit in all the good stuff they eat just so they don't have to share.
hooman,My hooman put a lot of food holders in the dishwasher. I like to help so I cleaned them all up for her but she said nonono and closed the big shiny door.
hooman,"When hooman puts food holders and pokers in the big whooshy water box they have no food already. I know because i taste test them all just to make sure. Hooman doesn't think they need to be tested, but I know better."
hooman,Iffen yu did a hooman swap fur a fureva sat instrucktshuns wud yu leeve to bee shure yu hooman stays hapy an helfy?
hooman,Why does my hooman get angry when I wake them up with licky face times? I try to help!
hooman,My hoomans put me and seester outside for trying to help eat the trash so they wouldn't has to throw it aways. How rood.
hooman,"If I pout and hooman can't sees me, is I relly pouting?"
hooman,The CLOUD demands it hooman.Gibb the bevermadge IMEDIATE
hooman,My hoomans made a hooman puppe this weak!! I now have for hoomans at home to play with!!
hooman,Wat do hoomanz do wif brokeen toyes?
hooman,Why is sometime the sunshine there and sometime the sky bath? Can hooman fix it to just be the sunshine there? I don't lik the skybath.
hooman,"If I iz a good boi in da woods and dere is no hooman dere to sez it, iz I still a good boi?"
hooman,"Did my wolf ancestors also love shmackos, playing fetch, ear scritches, and belly rubs? If so, I hope they did hooman's ancestors a face-lick to express their gratitude."
hooman,"Police doggo protec hooman police, so, why hooman police exist if thems need protec?"
hooman,"PSA Noticed my hooman picks up my poop from gardin. Decided he must enjoy dis. So when you take hooman for exploring smells around neighbourhood, Make sure do TWO poops for him..."
hooman,My hoomans bought back fluffy ting into garrdin. They r called wrabbits. My hoomans say 'no' when I wants to play wiv da wrabbits. Why dis?
hooman,I lov hooman. very much. hooman lov me too. very much.
hooman,Maybe hooman goes out wifout me to bring back new misterioos smells.
hooman,SELFEEEE SUNDAY!!! Took my hoomans fur a walkie!
hooman,"Hooman tricked us, we thought we were getting a walkie but now we are getting our hairs cut. These new hoomans are not our real hooomans. What if real hoomams never come back and this is new home now?"
hooman,My hooman said we couldn't go to the park because of Rayne. Who is Rayne? He must be stopped!
hooman,My hooman has not put indoor tree this yeer. Show me yur indoor trees an mebbes yu wiv it.
hooman,my hooman has decided that he loves his girl hooman more than me amd so i told pets before sex
hooman,"I am hooman. I like all doggos, do any doggos here want to let Me pat them? Only gud doggs not baddies."
hooman,What does hooman do with all of my poopies? He picks them up on our w.a.l.ks and collects them in the big treat container outside. I must investigate!
hooman,"i no many hooman wurds(lik dubleyu ay el kay, no, gubboy, sit) but hoooman know no borks(lik protecc bork, excitete bork or mailman bork)"
hooman,Wy hooman poot brik in faic?
hooman,y hooman eat poison ‘chooclite’
hooman,Hooman been taking Pennysister and I for WALKIES but make me “sit” all the time when I just wanna RUN. How do I get hooman to let me run??
hooman,"Hooman give me treats when i peepee, so if i peepee when i see hooman, i get treats"
hooman,"HELP! I thinks my hooman has Alzheimer's or somthin. Evry single day he leafs house, gets lost and comes back like weeks later. Maybe months, not sure. So sad :("
hooman,Why do my hooman keep asking for kis?
hooman,I only eat my hoomans soks because I know hooman don’t like it. If hooman would have never chased me to get sock back first time I probably wouldn’t chew up soks
hooman,"Sometimes on the fuzzy florr carpet, my hooman touches me and gives me zaps!"
hooman,"Wenever hooman friends come over, I am surounded. Y?"
hooman,Why can't hoomans see danger and trickery of skwerl? Must protect hoomans from skwerl
hooman,"BWARK BWARK! HALP! Seriously considering turning hooman into ASPCA, am thinking hooman has very slow brain or was dropped on head as pupper. Please read."
hooman,Heard hooman dadz woofs but could not seez him. Hooman dad says “hey doggo wanna go for a walk?” My eers got tall and my eyes were really alert but sound came frum little box and I didn’t know whats to do. What it little box? Will hooman dad be home to go for walkie soon?
hooman,Why hooman wayste day at home?
hooman,Hooman left chair unattend. I kep chair warm but hooman move me.
hooman,I watch doggos frum my window an sum have cloos like hoomans. Is they hoomans now?
hooman,My hooman says my breth is like a dead fish mawkit but when she say it she rinkle nose. I confused. Dead fish mawkit sound yummy.
hooman,"I noticed round noonish, when hooman takes her lunch, is perfect time for nap time. All aminals, including cats, take nap around then. Is best time for nap."
hooman,"Reading this sub make me raelly want to get a hooman, they seem like lot of fun ! But am not sure I can take good care of it..."
hooman,I preten to act confused when hooman preten to throw ball. He like it...
hooman,My is behid my ear. I like belly too. Wat iz yur sweet spot for hooman to pets you?
hooman,Hooman licks hooman then other hooman happy... Me licks hooman there me bad dog!! Awooo???!!
hooman,"I chase my big bwother awound table and it is fun and my hooman likes it, he gets happy so I chase more and sometimes I get climbed on by bwother and this is less fun and hooman says go get him so I do and then we drink water. Hooman says was that fun? Yes it fun so I look at him and say yes it"
