word,sentence
dogs,"Собака-улыбака, или как кормить собак? A dog-smile, or how to feed dogs?"
dogs,"Now, dogs! Be raised and motivated by the words of the great philosopher, Dogenes!"
dogs,The DMZ (xpost from /r/dogs by request)
dogs,Badger enlisted today. repost from /dogswearinghats
dogs,I made a Greasemonkey script that lets you see in-text Dogfort dogs in every area of Reddit. Enjoy.
dogs,"Gentledogs, I present to you the story of Sgt. Stubby, a true hero - Cross post from r/TIL"
dogs,"We all know how you feel about having dogs, but do any of you have digues?"
dogs,How do you feel about gundogs and working dogs?
dogs,Father and daughter attacked by pack of dogs on North Taranaki beach
dogs,"""All dog breeds are equal and there are no dangerous ones"" - dog owners [source: dogsbite.org]"
dogs,Watch: Pack of dogs terrorising neighbourhoods
dogs,"Are all dogs born equal? Some are big, some are small, some lots of hyoomans, some do not."
dogs,If chocolate is bad does that mean choco labs are bad dogs???
dogs,"Why is this sub called ""dogshowerthoughts"" when our only thoughts during a shower are ""BLGHFBSKSLEBA!!""?"
dogs,Cars are to dogs what Moby Dick was to Captain Ahab
dogs,"So, a drive-in restaurant near us caters to dogs. This is Kevyn enjoying a dog cone."
dogs,My dogs nose in macro 🔬
dogs,These are my dogs Ramiro (pitbull) and Talita (great dane). Even though she's two years younger she fits on top of him.
dogs,My two rescue dogs - Casey Gsd cross age 12 &amp; Bear Rottie age 8.
dogs,diana thorne color prints of dogs
dogs,Jack n Lexy Our Alapaha Blue Blood Bulldogs F.F. Fox'SFarm of ALAPAHA BLUE BLOOD BULLDOGS
dogs,"Few day ago, here in Croatia, leader of organization ""In the name of family"" that's against gay marriage said that dogs in bed are one of the reason people don't have children and that it makes her sick. So here is Fleki who died 3 years ago (age 13)!! FU lady"
dogs,Al Roker photodogs the red carpet
dogs,fordogs
dogs,"Clash of the Titans, kinda. Dog hike shenanigans. #adventuredogs"
dogs,Pensioner savaged by pack of dogs as owner watched attack (via r/BanPitBulls/)
dogs,I'm getting into amateur photography. I figured animals were a good idea to practice photos ons. Here are mine and my friends dogs.
dogs,Detroit Dog Recuse plans to take on more DAC dogs
dogs,Nice writup about testing self-awareness in dogs and other animals
dogs,All dogs are eequl - dont b breedist!!
dogs,y we name this sub dogshowerthoughts and not just showerthoughts? I'm very cunfuzed.
dogs,Are dogs in the glowbox real dogs?
dogs,We're a bunch of weirdos roleplaying as dogs.
dogs,Oh noes! My hooman found /r/dogsinsocks! I am doomed....
dogs,Get the dogs PUMPED! WROOF WROOF WROOF
dogs,Why does small non dog get wet yummies and I get yelled at when I trie to eat small non dogs wet yummies?
dogs,"Reddit users who say, ""That's not a dog showerthought!"" are just cats who don't know what dogs think about in the shower."
dogs,"I heard this belongs here. Do your dogs like balls, and ice cubes? Try an ice ball! Formed using a 'spherical icecube mold'. $10-$12 on amazon."
dogs,Stray dogs injure 16 people in Haripur
dogs,"Police investigate after two dogs attack child, babysitter tobogganing in Wallaceburg - Windsor"
dogs,Evidently /r/dogfree is nothing but edgelords cause we don't care for dogs...
dogs,Barbaric yalp on seeing distant dogs
dogs,"how to ""punsih"" when only using positive enforcement ? Or: how to train your dog to not run off isntantly to play with other dogs or greet people?"
dogs,Leash Agressiveness (x-post r/dogs)
dogs,"I need advice, and am willing to hire a trainer in Orange County, CA to work with my dog's fear-based aggression toward other dogs. This is a much more detailed post of the one I just posted in /r/OrangeCounty. More in text."
dogs,Training two dogs at the same time: 3yo miniature pincher and 7wo german shepherd
dogs,"Dog becomes only dog - becomes racist, also behavior changes ^aggression with small dogs/humans xpost from AmStaffPitts"
dogs,Furminators for dogs and cats are on Black Friday sale at chewy.com
dogs,TSA looking for people to adopt retired dogs in Baltimore - Dogalize
dogs,How do I help my 5y/o Pikanese/Pomeranian like other dogs?
dogs,Augusto DeOliviera of GSK (travels for dominance theory training in the USA) confirmed quarantined for Parvovirus. Has traveled with his dogs since being quarantined. Please be aware and spread the word.
dogs,Immediate improvement in your pets skin and coat after one washing www.matalas.biz https://www.indiegogo.com/projects/exciting-new-product-line-for-skin-healing-dogs/x/17002116#/
dogs,"[x-post from r/reactivedogs] Moving to Boston and am looking for recs for a trainer and/or Vet in the Somerville, Cambridge area."
dogs,New dog lover community: /r/truedogs
dogs,Im trying to start a disc dog subreddit. if anyone is interested its /r/discdogs. please come by and add a post to help get it started.
dogs,Got 3 dogs and they have started with some unsual behaviour. Any advice is welcome
dogs,"Really need help 😣 dogs have forgotten how to be house broken, i guess?"
dogs,"Doris (purple harness) grew up playing with other dogs, going to a dog park everyday. Now, after moving interstate she is now showing aggressive behaviour on occasion. When we moved she was w two unsocialised dogs who would gang up on her &amp; we weren’t able to visit the park everyday. Help please. 😰"
dogs,Are rocco chings jerky treat bad for my dogs?
dogs,6y/o boxer pitbull mix is extremely aggressive with other dogs
dogs,[Help] Worried my two dogs will kill/injure my 19year old dog?
dogs,"Tikken's first year trick compilation This dog is not yet 1 year old, and yet she can do more than most dogs."
dogs,Chihuahuas​ Barking at other dogs
dogs,I'm a total begginer and ANY help would be highly appreciated. 3 dogs to train.
dogs,"Do dogs get jealous of each other? (Have inside dog, might aquire outside dog)"
dogs,Barking nonstop and displaying aggressive behavior—but wants to play with other dogs?
dogs,[Impulse Control] How do you train a dog _not ever_ to do something through positive reinforcement? / How do you manage +R with the chaos of multiple dogs?
dogs,have a look at this fabilous store to find the best toys and houses for your dogs
dogs,Can I train my dogs to stay on ungated property?
dogs,My pottytrained dogs have starting having accidents in the house. Help!
dogs,Is it safe to use pepto bismol for my dogs? Apparently it is.
dogs,Ultimate waterless bath for pets that cleans and desheds dogs in minutes without the hassle and mess.
dogs,"My shiba, Magnus, is TERRIFIED of dogs."
dogs,I need help with training my two ~7y/o small dogs.
dogs,Audio books or podcasts to learn about dogs &amp; dog training?
dogs,Video how-to: Kongs for beginners; how to introduce food toys to inexperienced dogs or puppies to set up success (eileenanddogs)
dogs,10 month old frenchie wont stop peeing in his crate! (x-post from /r/frogdogs)
dogs,"Our 1yr old Aussy cross is a bitch to other dogs, in more than a biological sense."
dogs,Drivingdogs | Driving dogs
dogs,Experience using [Stop That](http://smile.amazon.com/Sentry-Noise-Pheromone-Spray-1-Ounce/dp/B0083F9OTW/ref=sr_1_1?s=pet-supplies&amp;ie=UTF8&amp;qid=1406042445&amp;sr=1-1&amp;keywords=stop+that+dog+spray) or another pheromone dog spray? What if you have multiple dogs?
dogs,"Loyal blueheeler to owners but aggressive with other dogs, family, and friends. Pls help on how to train and fix this."
dogs,How long after last Parvo shot untill my puppy can go out and meet new dogs?
dogs,Meeting dogs - PLAYTIIIMMEEE
dogs,My 1 and a 1/2 year old lab retriever is starting to become agressive towards other dogs in her adolecence. Are there any training methods that can help curb this behaviour before it becomes serious?
dogs,"I try to post these dogs on Pitbulls to try to find home, but thought some dogtraines would like to comment on this video. Gets interesting at about 2:43."
dogs,"Need some advice or links for research on dog on dog resource guarding. (xpost from /r/dogs, thought this was a more appropriate subbit)"
dogs,A bajillion books that owners of fearful dogs should consider
dogs,Take a break &amp; let the drone get your dogs their workout. These are my dogs chasing drones bc I can't throw a ball because of my back. I use Journey - Don't Stop Believin' for training.
dogs,Help How to resocialize a dog that doesn't want to be with unknown dogs?
dogs,Possesiveness when other dogs approach me
dogs,"Achieving &amp;amp; maintaining ear health for Dog,Cleaning: Most dogs’ ears do not…"
dogs,www.accessoriesdogs.com
dogs,2 year old Cheagle has become possessive with toys around other dogs
dogs,"Very excited to start gundog training this weekend, what do people use as reward with gundogs?"
dogs,These bonded dogs were adopted separately… then fate stepped in to reuni...
dogs,One of my dogs is an angel at the dog park and a Cujo on the leash
dogs,[X-POST r/Dogs] 4 Year Old Staffordshire Bull Terrier X - rescued and will rush at small dogs. How to desensitise?
dogs,"Two amle dogs, dynamics, etc"
dogs,Dog acting aggressive for dogsitters
dogs,"Dachshund anxious after trauma; will snap / run barking towards stragers, is generally scared of bigger dogs."
dogs,Took my deaf and deafblind dogs dock diving!
dogs,"If you have ANY questions about dogs, please considering asking my good friend, and protection dog trainer, Omri Geva, he is currently doing an AmA over /r/IAmA! [X-Post from /r/dogs]"
dogs,For those owners who have dogs that love to unstuff toys...
dogs,All our dogs want to go out 12x/day with just me
dogs,My dog won't stop playing aggressively with kther dogs
dogs,Neighbor upstairs complaining to landlady about my barking dogs (X-Post: AptLiving)
dogs,"Laurel Braitman: Depressed dogs, cats with OCD — what animal madness means for us humans"
dogs,"Moving to a new province, airplane flights and visits, oh my. How to keep my girl (4yrs, Decker Rat Terrier) happy and healthy. (xpost r/dogs)"
dogs,my 2 year old rotweiler mix is fascinated by youtube videos of dogs interacting with other animals. Is there anything i can show him with training usefulness?
dogs,"Can anyone point me in the right direction of some products, toys ets. that can help dogs with anxiety? Thanks!"
dogs,Puppy Training 101-Techydogs-Scoop On Puppy by Sharon Griswold
dogs,"My dogs are super ""howly"" and vocal (not actually barking) when I take them for a walk."
dogs,Help: my dog is dominantly and persistantly mounting smaller dogs at the dog park.
dogs,"sugestions, family dose not care about dogs"
dogs,"""We’re changing lives by improving the way people live and move with their dogs,” JWalker Dog Inventor, Jessica O'Neill"
dogs,One of my dogs bit the other dog in a fight. ☹
dogs,DogHQ - questions and answers community about dogs
dogs,Skiijoring is a Awesome and a fun way to exercise your dogs! These guys are having a blast! There's not only Huskies/malamutes who can pull you.
dogs,I was searching for dog grooming and training provider in rochester ny and i found adogsdream
dogs,Wikihow talks about how dogs are part of a pack and are dominance related... Anyone know how to suggest to them to change their approach?
dogs,Ramping up to deal with leash reactivity to other dogs?
dogs,[Help] Hi! I'm looking for a dog trainer or dogbehaviourist to ask some questions for my research about dogs. [takes about 10 min.]
dogs,Is it inherently wrong to give morcels to my dogs while I'm eating?
dogs,"A Browncoat’s Guide to Training and Living With Dogs (on Firefly, dogs and nerdlife.)"
dogs,Dealing with two dogs that go batshit at each other on-leash when they see a dog
dogs,Are Huskys bad dogs?
dogs,#ourdogsfly #dodiscdog
dogs,"Control Unleashed: Or, How Louise Learned to Stop Worrying and Love Her Job [x-post r/dogs, r/k9sports]"
dogs,"Our Chihuahua/Corgi mix is a bit of a train wreck… Help classify his behaviour? Please and thank you. (x-posted /r/dogs, /r/Pets, /r/Dogtraining)"
dogs,Pavlovs cat is a little different to pavlovs dogs.
dogs,"Try some pig pheromone to stop unruly dogs barking: If your dog is misbehaving, you might want to spray it with pig pheromones. Androstenone is found in boar saliva and helps induce sows to mate. Now it is the active ingredient in a spray marketed as being able to calm boisterous dogs"
dogs,"Shitty sub feature: r/reactivedogs, where nutters try to """"rehabilitate"" their aggressive dogs instead of putting them the fuck down"
dogs,My dog gets realllllly excited to see other dogs?
dogs,How to introduce dogs: My 8yr old golden retriever and my SOs 8 year old poodle will be cohabiting in about 2 weeks
dogs,XP: two dogs fighting to protect DD (3 months) from the other.
dogs,"May have to re-home both of my dogs, feeling guilt and confliction"
dogs,Advice introducing 2 dogs - Corgi and labPit
dogs,About to have my first puppy in a loooong time! Any tips for small breed dogs?
dogs,Rehabilitating a working dog into the pet world - [x-post /r/workingdogs]
dogs,[Resource] Jaquie is a disabled woman who actively trains her own service dogs. She has given some advice on this website.
dogs,Cracked skin had contact with water in a bowl where several dogs drink from. Should I get #Rabies vaccine? xpost /r/AskDocs
dogs,"Does anyone have any tricks or treats that they discovered while getting adopted dogs crate trained? Mosby is 2, but might as well be a puppy."
dogs,Question/Advice Needed about Rescue Dogs. Can you teach an old dog new tricks? (X-post Rescuedogs)
dogs,"PSA: Ibuprofen (Advil, Brufen, Motrin, Nurofen) is extremely toxic to dogs and 1 of these sugary pills could kill your puppy."
dogs,"Dogtrainers of Reddit, whats your thoughts on Head Harnesses for training leash behavior in strong / energetic dogs"
dogs,For dogs that travel in the car. Petbelt keeps them safe in their seat.
dogs,"Rescue Pitbull ~2 Years - Amazing with people, decent with dogs who dont bark at her, batcrap insane with dogs that do."
dogs,[help] Member of my family has 2 dogs. They're small (below 10 kgs/ 22 lbs each) but they tend to be aggressive towards each other but not only. Today we had to drag one away by force multiple times. Professional training is not an option since these dogs aren't mine. Can I do anything about it?
dogs,"Danette Johnston from Dog's Day Out shares her thoughts on the benefits of mental stimulation for dogs, puzzle toys, and PupPod."
dogs,Has anyone had experience with Xanax for dogs?
dogs,Help! My puppy has started getting possessive/aggressive around other dogs (with chewthings) at the dogpark...
dogs,What can I do with a determined escape artist? I have a Dalmador and she hates confined spaces. But she is the biggest trouble maker of our two dogs. What are some options?
dogs,"The best Command we have with our 3 dogs (85lbs, 45lbs, and 4.5lbs) is “Mind Your Business”"
dogs,Helping Trainging two female dogs
dogs,2 little dogs cannot coexsist in the same space. Please help!
dogs,Fostering with plans to adopt my first ever dogs… a husky and chihuahua bonded pair.
dogs,Flea question. Overnighting two 10.5 week old puppies tonight. The transport leaving KY said the pups have fleas. Besides a flea comb what can you treat such young dogs with?
dogs,Dogs are Babies’ Best Friends: Study Finds Babies Living With Dogs are a lot Healthier http://www.telegiz.com/articles/19562/20170330/dogs-babies-best-friends-study-finds-living-lot-healthier.htm?exe=reporter
dogs,know your pet dog diet plan only on dogsbreedusa.online
dogs,Can you identify my dogs breed? Hes half great pyrenes but im not sure what else.
dogs,Hello friends I am looking to start walking dogs down here in Mankato. I did this for my cousin in New York and loved it so if you have a furry friend go check out Rover and check me out. New users can get a discount by using my code.
dogs,"First time dog owner, recently adopted a 1.5 year old Mudi (Hungarian Shepherd). We could really use some help addressing our dog's fear/anxiety/reactivity to strangers and other dogs."
dogs,"I have 2 dogs, 1 has seperation anxety. Should i split them up before I leave the house?"
dogs,headsupfortails.com -&gt;10-reasons-dogs-lick
dogs,http://www.fenzidogsportsacademy.com/index.php/blog/post/4007-internal-motivation-do-we-value-it
dogs,Ways to get puppy (5months) to calm down when he sees other dogs?
dogs,"""Who's there?"" #r/funnydogs"
dogs,"Dantes thinks ginger dogs have no souls, she barks at them to compensate."
dogs,Hunting dogs attack three young sisters in Tokushima
dogs,Stray dogs unleash a reign of terror among residents of Kalas-Dhanori - Times of India
dogs,Off-leash dogs a rising problem in Kitimat | CBC News
dogs,Eckville Town Council adds guard dogs to Dog Control Bylaw
dogs,Skamania County woman survives attack by five dogs
dogs,I did it! I found the worst one yet - 'woofer'. *Barf*. They really like to romanticize the annoying behaviours of dogs.
dogs,"""During the third rectification of the Vuldronaii they were called 'nanny dogs!'"""
dogs,SoDo woman attacked by dogs from woman's RV
dogs,"So does this sub have a problem with dogs in general, or moreso with shitty owners and/or poorly trained/feral dogs? Just a random browser with curiosity"
dogs,GEDMatch...but for dogs?
dogs,"The Wisdom Panel results are in! But first, who wants to guess Kaia's breed? (X-post from /r/dogs )"
dogs,Embark results &amp; questions (pedigreed dogs/haplotype)
dogs,DNA test results: Thoughts and experiences on the Leonberger? [x-post from /r/dogs]
dogs,Results are in for my pomchi-cockerpug-doxiepoo [x-post r/dogs]
dogs,"An interesting article about humanising dogs, worth reading."
dogs,"""Dogs love eating human faces"" - Post-mortem decapitation by domestic dogs"
dogs,"So there was a post last year about Carolina Dogs DNA. CD dna doesn’t show up in wisdom panels but as Asian or ancient dogs. Here is my baby Julius Caesar (named after our Golden, Caear) and his results. His mixed almost 40% is Asian and Sighthound which is where the CD comes from Thoughts?"
dogs,CGPGrey on how dogs see colour
dogs,Amateur dogstyle interracial porn - 22 min
dogs,Has anyone used this product before to file their dogs nails? Does I️t work?
dogs,"Stressless for dogs, effortless for parents. For more information, please click here👉 https://www.kickstarter.com/projects/1283877409/bristly"
dogs,Moronic dogs trying to outswim a duck
dogs,"Hello, /r/all. /r/DogsMirin is currently a trending subreddit. Feel free to post pics of dogs mirin!"
dogs,Do yiu also accept mirin kitties who think they're dogs? He even plays fetch...
dogs,"Tippy in her usual spot, playing the waiting game (x-post r/happydogs)"
dogs,Why can't any of you leash your goddamn dogs? • r/santacruz
dogs,"We get a Re-hab range for your old buddies who sometimes get tired walking or have an eyesight problem because of the the growing age. Don't let them do feel old, rather help them grow old with you! Checkout the range at www.woofsnwags.in #woofsnwagsdotin #woofsnwags #olddogs #oldies #doglove"
dogs,Two fox terrier dogs seen running free in Whangārei forest kiwi zone
dogs,my dogs looks a like weaboo 29 honeysuckle dr 5112 adelaide south australia Hillbank SA 5112
dogs,HBPD addresses concerns about free roaming dogs
dogs,Male swan killed by pet dogs in Banora Point
dogs,Dog killed by wolves on Tofino beach prompts warning from district - keep dogs leashed and indoors at night
dogs,"Tinonee koalas being attacked, mauled and killed by dogs"
dogs,Anybody else here not absolutely depise dogs or actually own a dog?
dogs,I made the mistake of agreeing to dogsit.
dogs,NGOs to help in removal of roaming stray dogs – BorneoPost Online
dogs,Oklahoma passes law to prevent fake service dogs in rental housing https://newsok.com/article/5595967/renters-dont-falsify-your-pit-bull-as-a-service-animal-in-oklahoma
dogs,Visit - Why are dogs not allowed on site at Portmeirion?
dogs,"Drats — It's Rats! Vermin Invasion Rattles Winooski VT Neighborhood. No dogs but it shows the kind of people we have to deal with. If a person is against exterminating rats and saving mice, trying to talk to them about dogs is going no where."
dogs,"If youre allowed to be afraid of spiders or heights, I'm allowed to be afraid of dogs."
dogs,Ardmore woman killed by seven small dogs Thursday night
dogs,Spirit FM - News - New fines for those who don't control their dogs in Arun
dogs,"They have r/dogs, r/aww, and a few other subreddits. Get that vermin out of r/CATSWithHats! 😾"
dogs,Roaming dogs 'destroying' wildlife on North Stradbroke: Indigenous owners
dogs,This is a mod on /r/doghate. Seems they seized the subreddit to avoid criticism of dogs...
dogs,"Video which shows what dogs and cats would look like if they were human. Of course, the cat is portrayed as a huge asshole and the dog is overbearingly friendly😒"
dogs,"Octopath Traveler on Switch. Ironic how the game has this message that ""all dogs are good dogs"", when not more than 3 hours before I was fighting angry dogs as an enemy."
dogs,Town dogs attacking sheep and small animals in Murrurundi says sheep breeder (Australia)
dogs,Four dogs maul north man to death | Rekord North
dogs,City to unleash debate on dogs in Brookhaven Park
dogs,The guy in the background has two dogs with him. Wish I woulda snapped this picture when they were closer.
dogs,My daughter is terrifed of dogs
dogs,"Every YEAR in the US ALONE, 4.5 Million people are bitten by dogs and has increased 82% since the 1980s and is still rising leading to more than $1 BILLION a year in loses for the victims, Pit Bulls and the #1 attacker."
dogs,Concerns raised over dogs off leads on Budleigh seafront
dogs,Kaweka kiwis at risk with two dogs on the loose
dogs,Why do all dogs have such punchable faces?
dogs,Apparently anyone who doesn't like dogs has mental problems/is sad/angry/violent ect..
dogs,Livestock are being attacked by dogs in Peralta
dogs,r/dogsareassholes/ needs more attention than it currently gets so as to piss off the mutt lovers.
dogs,I’ve never seen dogs walk like this - Posted On Kakuka App
dogs,Watching the Tour de France and the commentators mention there is a history of dogs wandering into the race..... https://www.youtube.com/watch?v=9JGFn5s38uo
dogs,"Put my dog to permasleep due to aggression issues last night • /r/dogs (So, no psychotropic meds to calm it down. I guess it was cheaper to put the dog down; apparently its life isn't worth the cost of the meds to keep it calm.)"
dogs,https://www.washingtonpost.com/news/morning-mix/wp/2017/01/19/dogs-attacked-schoolchildren-walking-to-the-bus-leaving-one-dead-and-another-injured/?utm_term=.cb55fbe1fb25
dogs,You guys are the r/mgtow of dogs
dogs,14m old dog suddenly aggressive to people and dogs?
dogs,iSpeakDog launches today - a tool to help people communicate with their dogs
dogs,Today I lost my best friend • /r/dogs (A story of one with dogabetes and how insulin made it worse)
dogs,Intact 8month Aussie marking.. on other dogs?
dogs,Need help! Have two dogs one 4mo Huskie/Pitt mix &amp; one 5 year old Chihuahua/pug mix
dogs,"My petite TWC/Lab plays ""rough"" with dogs 3x her size - should I worry?"
dogs,Avail huge discounts by getting Capstar for dogs from BudgetPetWorld
dogs,What do you think of this remote controller? Is it helpfull in the training process? I am trying to train my dog on my own because I have been told that the dog trainers were beeting the dogs while training and I want my dog to be well treated.
dogs,2 yr. old Lab/Shepperd mix barks at dogs
dogs,K9 to 5: A pawsome guide to 6 types of professional dogs and what makes them such valuable working partners for humans.
dogs,Aggresion on leash and towards dominant or persistent dogs off leash?
dogs,You probably saw the new research on how dogs understand language. Here's how they trained them to lie still in the fMRI scanner!
dogs,What is doggits opinion on allowing dogs to fence run?
dogs,Reducing the reactiveness to neighborhood dogs barking
dogs,Is it possible to housebreak a puppy with unhousebroken dogs around?
dogs,[Help] My one year old Lagotto Romagnolo is getting increasingly aggressive with our other dogs and people.
dogs,Gardener bitten by dogs in Hillcrest
dogs,Pack of dogs kills FFA student's goats - Story
dogs,[help] Need help training an EPI dog. Calling all owners of EPI dogs!!!
dogs,"(xpost from r/HistoryPorn) [WW1] Battle fatigued soldiers stare into the camera but the machine gun dogs turn their heads to a sound or smell that comes from their right, Belgium 1914. [735x500]"
dogs,Petition to shut down Augusto Deoliviera/Griffin Shepherd Kennels for abuse and fraud. Info in comments. [X-post to /r/dogs]
dogs,"/r/dogswithunderbites , I am here to take over!"
dogs,Fear for roaming dogs as wallaby mauled at Springdale Heights
dogs,"Disabled veterans file suit involving service dogs against bakery, city of Longmont"
dogs,"""Colorful dogs on the beach"" by bles-art"
dogs,"Please post pictures and experiences dogsledding, either as a passenger or a musher, or even just an enthusiastic admirer!"
dogs,Owner of dogs involved in fatal attack on Bozeman woman: “They never showed aggression.”
dogs,/r/dogswithbandanas - Dogs wearing bandanas!
dogs,Dog gaurds me around other dogs
dogs,"I don't at all mind dogs, but I do mind this disgusting, humourless circlejerk"
dogs,Natalia Valdebenito has a stand-up special on Netflix specifically mentioning her hatred of dogs!
dogs,"How do I get my dogs to stop chasing dirtbikes, joggers, and cyclists?"
dogs,"(x-post from r/dogs) What are your opinions of the leash called Bungee Pupee? I was recommended this leash by somebody at the dog park, and am not sure if I should invest the $30 when I'm unemployed."
dogsbite,"""All dog breeds are equal and there are no dangerous ones"" - dog owners [source: dogsbite.org]"
